,productTitle,originalPrice,price,sold,tagText,Discount_percentage
0,Dresser For Bedroom With 9 Fabric Drawers Wardrobe Steel Frame Assembly Closet For Clothes Storage Display Cabinet Of Furniture,0.0,46.79,600,100,-inf
1,"Outdoor Conversation Set 4 Pieces Patio Furniture, Wicker Patio Chair Sofa Set w/ Water-Resistant Dark-Brown Cushion & Tempered",0.0,169.72,0,100,-inf
2,Desser For Bedroom With 7 Fabric Drawers Organizer Storage Closet Chest Clothes For Living Room Display Cabinet Of Furniture,78.4,39.46,7,100,49.66836734693878
3,"Modern Accent Boucle Chair,Upholstered Tufted Creative Furniture Sofa Couch Lounge Reading Chair for Living Room Home Decorative",0.0,111.99,0,100,-inf
4,Small Unit Simple Computer Desk Household Wooden Minimalist Tea Table Wooden Minimalist Small Makeup Table Home Furniture,48.82,21.37,1,100,56.22695616550594
5,"3 Pieces Patio Furniture Set, Outdoor Swivel Glider Rocker, Wicker Bistro Set with Rattan Rocking Chair, Glass Top Table",1294.04,123.4,53,100,90.46397329294302
6,"5-Piece Patio Furniture Set Outdoor Couch with Glass Coffee Table and Two Pillows, Outdoor Sectional Conversation Set",0.0,198.31,1,100,-inf
7,"Living Room Furniture, Modern 3-Piece Including Three-Seater, Loveseat and Single Chair,Dutch Velvet Upholstered Sofa Set",1474.17,734.58,5,100,50.16992612792283
8,TV Stand Dresser For Bedroom With 5 Fabric Drawers Organizer Storage Closet Chest Clothes Storage Display Cabinet Of Furniture,0.0,43.96,3,0,-inf
9,"Outdoor Furniture Set 3 Pieces Wicker Patio Furniture Outdoor Sectional Patio Couch Outdoor Coffee Table,Khaki",0.0,233.3,0,100,-inf
10,"4 Pieces Patio Furniture Set, Outdoor Rattan Woven Conversation Sectional L-Shaped Sofa with 5 Seater for Backyard",0.0,244.17,1,100,-inf
11,"Jela kids couch 14PCs luxury, floor sofa modular furniture for adults, Playhouse play set toddlers babies, Modul",0.0,238.18,0,100,-inf
12,"3/4/5 Piece Boho Outdoor Patio Furniture Sets with Egg Chair and Ice Bucket, Small L Shape Wicker Conversation Sectional Sofa",0.0,495.8,0,100,-inf
13,"3 PCS Patio Conversation Set, Solid Eucalyptus Wood Frame Outdoor Wicker Furniture Set Bistro Set with Coffee Table",0.0,117.66,0,100,-inf
14,Modern luxury lounge chair home furniture hotel bedroom lounge chair living room accent chair,0.0,978.88,0,100,-inf
15,"Furniture Contemporary Reversible Sectional Sleeper Sectional Sofa with Storage Chaise in Dark Gray Fabric, free shipping",0.0,440.94,0,100,-inf
16,"Patio Furniture Sets - 3 Pieces Rattan Sofa Set, Outdoor Conversation Set with Tempered Glass Tabletop, Outdoor Furniture Sets",0.0,183.3,0,100,-inf
17,"Patio Dining Set Outdoor Furniture with 6 Stackable Textilene Chairs and Large Table for Yard, Garden Porch and Poolside, Grey",0.0,60.28,4,100,-inf
18,7 Pieces Patio Furniture Set - Outdoor Sectional Wicker Rattan Furniture with Cushion and Glass Table Patio Conversation,0.0,376.5,0,100,-inf
19,"47"" Small Modern Loveseat Couch Sofa, Fabric Upholstered 2-Seat Sofa, Love Seat Furniture with 2 Pillows, Wood Leg Sofas",0.0,204.93,0,100,-inf
20,7-piece patio furniture set modular wicker outdoor sectional sofa PE rattan outdoor set with pillowtop cushions and coffee table,671.47,331.24,39,100,50.66942678004974
21,Patio Furniture Sets All Weather Outdoor Sectional Sofa Manual Weaving Wicker Rattan Patio Seating Sofas with Cushion & Table,0.0,276.65,0,100,-inf
22,Office Furniture Computer Stand 42*26cm Adjustable Foldable Laptop Holder Notebook Desks Lap PC Folding Desk Table Vented Stand,56.58,26.03,1000,100,53.994344291268995
23,"4-Piece Outdoor Patio Furniture Set,Wicker Rattan Sectional Sofa Couch with Glass Coffee Table|Black Easy Cleaning and Stronger",0.0,321.05,1,100,-inf
24,5 Pieces Patio Furniture Set Outdoor Sectional Rattan Daybed Conversation Sofa Set Wicker Couch with & Tempered Glass,0.0,219.63,0,100,-inf
25,"6Pieces Wicker Patio Furniture Sets Outdoor Conversation Set PE Rattan Sectional Sofa Couch with 30"" Fire Pit Table and Cushions",0.0,574.86,0,100,-inf
26,"Aluminum Patio Furniture Set, Modern Patio Conversation Set, All Weather Dark Grey Outdoor Sectional Sofa Set w/Table",0.0,497.44,1,100,-inf
27,"75"" X 32"" Expandable Dining Table - a Oval Wooden Table Top With Metal Legs Room Furniture Home",0.0,382.06,0,100,-inf
28,Modern Small Bedside Table with Drawer Lock Nordic Minimalist Bedside Cabinet Storage Cabinets Nightstands for Bedroom Furnitur,98.79,49.39,1,100,50.0050612410163
29,"5 Piece Patio Furniture Set, Outdoor Dining Table Set with L-Shaped Sectional Sofa, 2 Ottomans, Outside Conversation",0.0,225.91,1,100,-inf
30,"Greesum 3 Pieces Patio Furniture Set Outdoor Conversation Textilene Fabric Chairs for Garden,Balcony, with A Glass Coffee Table",0.0,74.17,0,100,-inf
31,Mid Lounge Replica Solid Wood Three-Legged Shell Chair Ash Plywood Black Faux Leather Living Room Furniture Modern Leisure Chair,0.0,179.99,2,100,-inf
32,Folding Desk Small Writing Desk Dressing Table Adjustable Height Space Saving Office Furniture Mobile Bookshelf,86.61,48.56,3,100,43.93257129661702
33,Home Furniture Shoe-shelf Headboards Shoe Cabinet Hallway Shoerack Living Room Cabinets Shoes Organizer External Storage Wheel,15.71,9.71,110,100,38.192234245703375
34,Makeup Vanity Organizer Makeup Vanity Desk With Mirror and Lights Dressers for Bedroom Furniture 5 Drawers & Storage Bag Dresser,0.0,172.36,5,100,-inf
35,"High dresser 12 drawers Black dresser and closet hallway, living room, bedroom furniture, wooden top and metal frame texture",0.0,91.06,0,100,-inf
36,"3 Pieces Patio Furniture PE Rattan Wicker Chair Conversation Set, 26.6x12.1x19.3 inches, Assemble Easily, Sturdy&Durable",0.0,86.8,18,100,-inf
37,Simple Wardrobe Portable Large Capacity Assembly Storage Closet Bedroom Furniture Durable and Sturdy Clothes Dustproof Wardrobe,82.27,40.13,1,100,51.22158745593776
38,"Wisteria Lane Outdoor Patio Furniture Set, 7-Piece Outdoor Dining Sofa Set with Dining Table and Chairs with Footstool",0.0,445.4,1,100,-inf
39,"5-Piece Patio Furniture Set Outdoor Couch with Glass Coffee Table and Two Pillows, Outdoor Sectional Conversation Set",0.0,270.59,1,100,-inf
40,"Patio Furniture L-Shaped Coversation Sectional Outdoor Sofa Set for Backyard, Porch with Thick Cushions Detachable Lounger",0.0,157.84,0,100,-inf
41,5 Pieces Patio Furniture Sets All Weather Outdoor Sectional Sofa Manual Weaving Wicker Rattan Sofas with Cushion and Glass Table,0.0,123.57,1,100,-inf
42,"3 Pieces Rocking Wicker Bistro Set, Patio Outdoor Furniture Conversation Sets with Porch Chairs and Glass Coffee Table, Beige",251.56,87.08,11,100,65.384003816187
43,"75"" X 31"" Portable Foldable Guest Bed for Adults Folding Bed With Mattress Beds and Furniture Storage Bag Included Bedroom",0.0,177.76,0,100,-inf
44,"7 Piece Outdoor Patio Furniture Set, PE Rattan Outdoor Grey Wicker Furniture, Outdoor Sectional Furniture Chair Set",0.0,384.35,0,100,-inf
45,"3 Piece Bistro Set Patio Rocking Chairs Outdoor Furniture w Warm Gray Cushions, Glass-Top Table for Garden, Pool, Backyard",0.0,161.63,0,100,-inf
46,"5 Pcs Patio Furniture Sets, Wicker Patio Furniture Set with Washable Cushions & Glass Coffee Table for Garden, Poolside",0.0,288.54,0,100,-inf
47,"5 Piece Outdoor Patio Furniture Set, Sectional Conversation PE Wicker w/Light Cushions, Poolside Balcony Outside Furniture Sets",0.0,404.78,0,100,-inf
48,Outdoor Furniture Sets Sectional PE Rattan Outdoor Furniture Patio Conversation Set with Cushions for Balcony Lawn and Garden,736.43,435.86,5,100,40.81446980704207
49,"Patio Furniture Outdoor Set, Terrace Sofa Set, All-weather PE Rattan with Padded Cushions, Garden Furniture Sets",665.74,393.44,16,100,40.9018535764713
50,"7 Pieces Patio Furniture Set, Outdoor Sectional Sofa Conversation Set, All Weather Wicker Rattan Couch Dining Table & Chair",0.0,432.98,1,100,-inf
51,"47"" Small Modern Loveseat Couch Sofa, Fabric Upholstered 2-Seat Sofa, Love Seat Furniture with 2 Pillows, Bedroom, Apartment",0.0,144.05,0,100,-inf
52,"6 Piece Patio Furniture Set, Outdoor Sectional Conversation Rattan Sofa Set with Ottoman and Outdoor Storage Table",0.0,335.98,6,100,-inf
53,Flamaker Patio Chairs 3 Piece Acacia Wood Patio Furniture with Coffee Table & Cushions Outdoor Conversation Set Balcony Chairs,0.0,96.15,7,100,-inf
54,"Shintenchi 5 Pieces Outdoor Patio Sectional Sofa Couch, Silver Gray PE Wicker Furniture Conversation Sets with Washable Cushions",407.85,279.49,3,100,31.472355032487435
55,"5 Pcs Outdoor Patio Sectional Furniture Set, Weather Resistant Rattan Outside Couch, Waterproof Conversation Sofa, Furniture set",0.0,313.48,0,100,-inf
56,"5Pcs Patio Furniture Set, Sectional All-Weather Grey PE Wicker w/Light Cushions, Backyard Porch Garden Poolside Balcony Set",0.0,308.39,0,100,-inf
57,"Dining table set, kitchen table and chairs, 4-seater dining table and chairs, home furniture, rectangular modern style",0.0,136.04,0,100,-inf
58,"4-piece terrace furniture set, small backyard tavern rocking chairs, double sofa and glass table textile outdoor dialogue set",0.0,160.01,0,100,-inf
59,Nightstands Modern Single Drawer Bedside Table Walnut Wood Bedroom Furniture Bedside Table,0.0,86.77,1,100,-inf
60,Makeup Table With 5 Drawers & Shelves Vanity Table Set Large Vanity Desk With Mirror and Lights White and Gold Bedroom Furniture,313.69,175.94,1,100,43.912780133252575
61,ACME Furniture Dresden 2-Drawer Rectangular Wood Nightstand in Bone White,0.0,552.62,0,100,-inf
62,Side Table for Living Room Bed Room Bedside Tables Modern Nightstand With 2 Drawers Furniture Silver Bedroom Home,0.0,122.3,1,100,-inf
63,"Convertible Sofa Bed, 3-in-1 Multi-Functional Velvet Sleeper Couch Pull-Out Bed Hidden Side Table for Living Room, Small Space",0.0,266.5,2,100,-inf
64,"ACME Furniture Upholstered Nightstand with 2 Drawers, Gray Velvet",0.0,303.56,0,100,-inf
65,"6Pieces Wicker Patio Furniture Sets Outdoor Conversation Set PE Rattan Sectional Sofa Couch with 30"" Fire Pit Table and Cushions",0.0,574.86,0,100,-inf
66,Dressers for Bedroom Furniture Thickened Frame Dresser Vanity Table for Makeup Furnitures Hallway Kids Room Make Up Table Toilet,72.43,31.71,60,100,56.219798426066546
67,"Dresser for Bedroom, Storage with 5 Drawer Organizer Closet Chest Small Clothes Fabric Cabinet, Kids Furniture Drawer Binis",0.0,36.39,0,100,-inf
68,Modern Faux Leather Sofa Bed Convertible Folding Futon With Armrest Home Recliner Home Furniture for Living Living Room Sofas,0.0,105.3,4,100,-inf
69,"King Size Bed Frame Heavy Duty Bed Frame With Faux Leather Headboard Bedroom Furniture 12"" Under-Bed Storage Black",0.0,101.98,0,100,-inf
70,"3 PCS Patio Conversation Set, Solid Eucalyptus Wood Frame Outdoor Wicker Furniture Set Bistro Set with Coffee Table",0.0,117.66,0,100,-inf
71,"LostCat Buffet Sideboard,Console Table with Storage,with 4 Drawers and Cabinets,Easy Assmebly for Kitchen,Dining Room",0.0,194.17,0,100,-inf
72,Length of Values Black Gaming Desk Table Office Furniture Computer Offices L Shaped Desk for Compuradora Desktops Furnitures,0.0,48.43,6,100,-inf
73,"Armoire Wardrobe Closet - White 32""W x 35""H x 20""D Cabinet for Functional Clothes Storage with Hanging Rail home furniture",0.0,159.73,0,100,-inf
74,"Living Room Sofa Set , L Shape Modular Storage Ottoman & Chaise, Comfy Corner Sofa Cup Holder Living Room Furniture Couch Sets",983.42,584.05,1,100,40.61031909052083
75,"Vanity Set,3 Color Touch Screen Dimming Mirror with Display, 4 Drawers,Makeup Dressing Table with Cushioned Stool Dressers",0.0,218.84,0,100,-inf
76,7 Pieces Patio Furniture Set - Outdoor Sectional Wicker Rattan Furniture with Cushion and Glass Table Patio Conversation,0.0,376.5,0,100,-inf
77,5 Pieces Patio Furniture Set Outdoor Sectional Rattan Daybed Conversation Sofa Set Wicker Couch with & Tempered Glass,0.0,219.63,0,100,-inf
78,"Aluminum Patio Furniture Set, Modern Patio Conversation Set, All Weather Dark Grey Outdoor Sectional Sofa Set w/Table",0.0,497.44,1,100,-inf
79,"Smug Recliner Chair Massage Reclining for Adults, Comfortable Fabric Recliner Sofa Adjustable Home Theater Seating Lounge with P",0.0,106.19,0,100,-inf
80,"Nightstand,Bedside Tables with Fabric Storage Drawer and Open Wood Shelf,Bedside Furniture,Mesa de Noche Drawers,",0.0,21.22,3,100,-inf
81,"GTPLAYER Chair Computer Gaming Chair (Leather, Ivory)， office furniture gaming chair",0.0,129.68,8,100,-inf
82,Makeup Table With 5 Drawers & Shelves Vanity Table Set Large Vanity Desk With Mirror and Lights White and Gold Bedroom Furniture,0.0,143.98,0,100,-inf
83,Nathan James Bailey Upholstered Rattan Bar Stool in Oak Finish Frame,0.0,172.61,1,100,-inf
84,Modern Small Bedside Table with Drawer Lock Nordic Minimalist Bedside Cabinet Storage Cabinets Nightstands for Bedroom Furnitur,98.79,49.39,1,100,50.0050612410163
85,Dressers for Bedroom Milky-White Storage Makeup Vanity Desk With Large Lighted Mirror With Power Outlet and LED Strip Furniture,0.0,151.55,4,100,-inf
86,2/5 Pieces Patio Furniture Sets All Weather Outdoor Sectional Patio Sofa Manual Weaving Wicker Rattan Patio Seating Sofas,0.0,237.47,11,100,-inf
87,Retro Sideboard Glass Door with Curved Line Design Ample Storage Cabinet with Black Handle and Three Adjustable Shelves,0.0,282.27,0,100,-inf
88,"5 Piece Patio Furniture Set, Outdoor Dining Table Set with L-Shaped Sectional Sofa, 2 Ottomans, Outside Conversation",0.0,225.91,1,100,-inf
89,"3 Pieces Patio Furniture Set Outdoor Conversation Textilene Fabric Chairs for Lawn, Garden, Balcony, Poolside",0.0,55.96,1,100,-inf
90,"Greesum 3 Pieces Patio Furniture Set Outdoor Conversation Textilene Fabric Chairs for Garden,Balcony, with A Glass Coffee Table",0.0,74.17,0,100,-inf
91,"EASELAND Sofa Couch, 88” Chenille Loveseat Comfy Couches for Living Room, Modern Deep Seat Sofa with Removable Back and Seat Cus",0.0,305.08,1,100,-inf
92,"Sofa Bed Reversible Convertible Sleeper Pull Out Couches with Storage Chaise, Linen Fabric Furniture for Living Room, Apartment",633.27,342.3,19,100,45.94722630157752
93,3 Pieces Rocking Chairs Set - Outdoor Wicker Rattan Rocking Chairs with Thickened Cushions，Boho Patio Furniture,0.0,149.82,0,100,-inf
94,"Aidan Sling Accent Chair / Metal Framed Armchair with Shredded Foam Cushioning, Oatmeal Chairs Living Room Furniture",0.0,77.65,1,100,-inf
95,"Deep Seat Sectional Sofa Cloud Couch with Ottoman, 76.7"" Modern Chenille Comfy Upholstered Modular Sofa L Shaped Couch",0.0,423.56,0,100,-inf
96,TV Stand Dresser For Bedroom With 5 Fabric Drawers Organizer Storage Closet Chest Clothes Storage Display Cabinet Of Furniture,0.0,43.96,3,0,-inf
97,"New Prepac Fremont 5-Drawer Chest for Bedroom, 16"" D X 31.5"" W X 45.25"" H, Espresso Dressing Table Bedroom Furniture",0.0,145.9,5,100,-inf
98,Folding Desk Small Writing Desk Dressing Table Adjustable Height Space Saving Office Furniture Mobile Bookshelf,86.61,48.56,3,100,43.93257129661702
99,Air Dresser LED White Vanity Set With Stool and Power Outlet Bedroom Furniture Home Makeup Vanity Table Girls(White) Furnitures,355.38,200.12,28,100,43.68844617029658
100,Desser For Bedroom With 7 Fabric Drawers Organizer Storage Closet Chest Clothes For Living Room Display Cabinet Of Furniture,78.4,39.46,7,100,49.66836734693878
101,Sturdy Steel Frame Vanity Desk Hallway Dresser for Bedroom Furniture Entryway Furnitures Wood Top Closets Dresser With 3 Drawers,0.0,38.58,2,100,-inf
102,"Mid-Century 6 Drawer Dresser For Bedroom, 16"" D x 52.50"" W x 33"" H, Brown/White",0.0,361.06,0,100,-inf
103,Full Size Bed Frame Queen Bedroom Furniture Upholstered Panel Bed in Black,0.0,90.8,4,100,-inf
104,"Living Room Sofa,Beige Linen Modern 3 Seater L Shaped Upholstered Furniture,Reversible Footrest with Storage Sofa",0.0,297.24,1,100,-inf
105,Faux Leather Sleeper Sofa With Mattress and Frame Living Room Sofas Convertible Futon Couch for Living Room Furniture White,0.0,150.54,7,100,-inf
106,Simple Wardrobe Portable Large Capacity Assembly Storage Closet Bedroom Furniture Durable and Sturdy Clothes Dustproof Wardrobe,82.27,40.13,1,100,51.22158745593776
107,"Bedroom Furniture Metal Four Post Canopy Bed Frame 14 Inch Platform, No Springs Required, White, King Size Bed",0.0,186.18,0,100,-inf
108,VEVOR Ergonomic Rocking Wooden Kneeling Chair Stool Correct Posture Computer Chair Original Home Office Furniture Thick Cushion,108.32,58.99,223,100,45.54098966026587
109,"Sofa with 2 Seats W/Armrest, Upholstered Love Seat Velvet 2-Seater Couches for Living Room, Sofa with 2 Seats",0.0,141.18,1,100,-inf
110,"7 Pieces Patio Furniture Set Sectional Rattan Wicker Sofa Outdoor Conversations Sets with Table for Garden, Poolside, Backyard",0.0,377.51,2,100,-inf
111,"Wisteria Lane Outdoor Patio Furniture Set, 7-Piece Outdoor Dining Sofa Set with Dining Table and Chairs with Footstool",0.0,445.4,1,100,-inf
112,Makeup Vanity Table Set Glass Top Makeup Vanity Table With 10x Magnifying Mirror 3 Light Settings (Modern White) Furnitures Desk,0.0,167.79,1,100,-inf
113,"Walker Edison Modern Scandinavian Fluted Door Kitchen Storage Sideboard Buffet Cabinet Console, 69 Inch, Coastal Oak/Black",0.0,302.17,0,100,-inf
114,Nordic Plastic Sofa Side tables mini Corner coffee table home decor low Bedside tables living room round Small stool Furniture,0.0,103.78,15,100,-inf
115,Bedroom Bedside Table of Furniture High Gloss LED Nightstand Acrylic Bedside Table With 3 Drawers for Bedroom Living Room Tables,0.0,84.52,1,100,-inf
116,"Patio Furniture L-Shaped Coversation Sectional Outdoor Sofa Set for Backyard, Porch with Thick Cushions Detachable Lounger",0.0,157.84,0,100,-inf
117,"110"" Sectional Sofa Cloud Couch for Living Room, Modern Chenille U Shaped Couch, Comfy Modular Sofa Sleeper with Double Chaise",0.0,713.77,0,100,-inf
118,Makeup Table Makeup Vanity With Lights Make Up Table 2 Cabinets & Long Storage Shelf Furniture Bathroom 10 Led Lights White Desk,0.0,157.05,12,100,-inf
119,"4 Pieces Patio Furniture Set, Outdoor Rattan Woven Conversation Sectional L-Shaped Sofa with 5 Seater for Backyard, Porch,",0.0,302.94,0,100,-inf
120,"Garden Furniture Set 7 Piece, Patio Couch Sets Chair, PE Rattan Sectional with 45"" Fire Pit Table, Garden Furniture Set",1506.07,897.64,6,100,40.39852065309049
121,"Makeup Vanity Table with Lighted Mirror, 3 Drawers and 3 Storage Shelves, 3 Lighting Sets, Dressing Table Vanity Desk Dressers",0.0,192.58,0,100,-inf
122,"Valita 7 Piece Outdoor PE Wicker Furniture Set, Patio Black Rattan Sectional Sofa Couch with Washable Khaki Cushions…",0.0,443.39,0,100,-inf
123,"Lazy Sofa Bedroom Room, Tatami Small Apartment, Balcony Small Sofa Bean Bag Sofa Set Living Room Furniture Lounge Chair",0.0,93.82,1,100,-inf
124,6pcs Patio Furniture Set PE Gray Rattan Wicker Sectional Outdoor Sofa Set Outside Couch W/Blue Washable Seat,0.0,356.63,1,100,-inf
125,"Modern Living Room Chair with Pillow Cushion with Solid Wood Frame and Upholstery, Suitable for Living Room, Bedroom, Beige",0.0,115.92,0,100,-inf
126,"Cushions for Patio Furniture Replacement, Patio Furniture Cushions, Deep Seat Cushions, Outdoor Seat Cushions",449.85,263.91,15,100,41.333777925975326
127,Coffee Table Tv Cabinet White Kitchen Cabinets for Living Room Sets Furniture LED TV Stand for 55 Inch TV Bedroom Wall Shelves,208.94,115.19,30,100,44.86934048052073
128,Turn-N-Tube No Tool 3-Tier Entertainment TV Stands Multicolor Living Room Furniture,0.0,42.06,2,100,-inf
129,"Crosley Furniture Soho Turntable Stand, side table,Mahogany,17.75 x 21.75 x 39 inches,Suitable for living room, study, bedroom",0.0,115.28,0,100,-inf
130,"Set of 2 LED Nightstand with 2 Drawers, Bedside Table with Drawers for Bedroom Furniture, Side Bed Table with LED Light, White",213.67,111.74,14,100,47.7044039874573
131,"Rane Convertible Sofa Bed, Sofa Set Living Room Furniture",0.0,107.9,1,100,-inf
132,"Bedroom Furniture Metal Platform Bed Frame, Wooden Slats Support, No Springs Required, Easy To Assemble, White, Full",0.0,73.74,6,100,-inf
133,"Freestanding Shoe Cabinet with 3 Flip Drawers, 2 Layer Shoe Shelf, Natural Rattan Shoe Storage Organizer,(1 Piece, Oak)",0.0,131.76,0,100,-inf
134,Lazy Sofa Sofa Chair balcony Leisure sleep Sofa living room sofas Modern easy chair small Sofa with Stool Bedroom Furniture,0.0,94.75,53,10,-inf
135,Gaming Chair Cheap Desk Chair Executive PU Leather Rolling Swivel Computer Chair With Lumbar Support Grey Office Furniture,0.0,89.13,7,100,-inf
136,Vanity Desk With Stool Makeup Vanity Table Set 3 Color Lighting Modes Brightness Adjustable Dressers for Bedroom Furniture Girls,0.0,156.84,1,100,-inf
137,"8 Drawer Dresser Wide 47.2'' Long, Storage Chest of Drawer for 55'' TV Stand in Closet, Wooden Top Industrial Furniture",0.0,85.01,0,100,-inf
138,16 Drawer Dresser Women's Furniture Makeup Dressing Table Fabric Dresser for Bedroom Large Chest of Drawers Make Up Table Vanity,0.0,82.36,1,100,-inf
139,"7 Pieces Patio Furniture Set, Modular Patio Set Wicker Outdoor Sectional Sofa Set PE Rattan Wicker Patio Conversation Set",0.0,265.91,1,100,-inf
140,Makeup Vanity Organizer Makeup Vanity Desk With Mirror and Lights Dressers for Bedroom Furniture 5 Drawers & Storage Bag Dresser,0.0,148.59,1,100,-inf
141,ROJASOP Shoe Storage Cabinet 12-Tier Organizer 96 Pairs Extra Large Plastic Shoe Rack with Covers Portable,0.0,148.63,2,100,-inf
142,Makeup Vanity Desk With Large Lighted Mirror With Power Outlet and LED Strip Furniture for Bedroom Toiletries Dressing Table,0.0,165.14,2,100,-inf
143,3 Piece Patio Furniture Outdoor Bistro Set Metal Action Lounge Cushioned Chairs and Bistro Round Table Set,0.0,131.97,1,100,-inf
144,"5-Piece Wicker Patio Furniture Set, All-Weather Outdoor Conversation Set Sectional Sofa with Water Resistant Grey Thick Cushions",0.0,313.75,0,100,-inf
145,"Gately Traditional End Table with Electrical Outlets, Brown，Small side table, Exquisite ，suitable for living room and bedroom",0.0,351.62,0,100,-inf
146,"3 Pieces Patio Furniture Set, Includes Set of 2 Outdoor Acacia Wood Cushioned Chairs and Coffee Table，Patio Set",0.0,164.72,0,100,-inf
147,"Modular sofa, Beige linen modern 3 seater L shaped upholstered furniture, Reversible footrest with storage and pockets",0.0,208.23,1,100,-inf
148,Air Dresser LED White Vanity Set With Stool and Power Outlet Bedroom Furniture Home Makeup Vanity Table Girls(White) Furnitures,0.0,222.59,4,100,-inf
149,"Elegant White Shoe Storage Cabinet, Space-Saving Solution with Cubbies for 36 Pairs, 13""D x 23.5"" W x 72.5"" H,Furniture",0.0,139.27,0,100,-inf
150,Makeup Vanity Table Set Glass Top Makeup Vanity Table With 10x Magnifying Mirror 3 Light Settings (Modern White) Furnitures Desk,355.38,207.23,4,100,41.687770836850696
151,"5 Pcs Patio Furniture Sets, Wicker Patio Furniture Set with Washable Cushions & Glass Coffee Table for Garden, Poolside",0.0,288.54,0,100,-inf
152,Sofas for Home Furniture Velvet Upholstered 2 Seater Couch with Square Arms and Tufted Back Sofa Living Room Sofas,0.0,129.15,3,100,-inf
153,"Side Table,Modern end Table,Metal nightstand,Bedside Tables,Accent Table with Storage for Living Room Bedroom entryway Couch",0.0,86.86,0,100,-inf
154,1: 12 Miniature Wooden Furniture: Wood Cabinet with Drawers Fairy Home Decoration Unpainted DIY Accessories,4.49,1.99,1,100,55.67928730512249
155,"Franklin 2 Drawers, Soft White Accent Table Bedroom Furniture Nightstands for Bedroom",0.0,81.02,0,100,-inf
156,Outdoor Furniture Sets Sectional PE Rattan Outdoor Furniture Patio Conversation Set with Cushions for Balcony Lawn and Garden,736.43,435.86,5,100,40.81446980704207
157,Sectional Couch W/Chaise Sleeper Sofa Chenille Small L Shape Sofa Couch Living Room Furniture Home,0.0,484.46,0,100,-inf
158,Gaming Desk White Modern Home Office Desk Table Computer Desks Gray Furniture Pliante Reading Room Study Accessories Laptop,0.0,163.42,5,100,-inf
159,Shoe Furniture Modern and Contemporary Transitional Natural Oak Finished Wood 1-Drawer Shoe Cabinet Free Shipping Organizer Room,0.0,103.38,4,100,-inf
160,"4-Piece Outdoor Patio Furniture Set,Wicker Rattan Sectional Sofa Couch with Glass Coffee Table|Black Easy Cleaning and Stronger",0.0,321.05,1,100,-inf
161,"8 Drawers Dresser for Bedroom, Kidsroom Furniture, Tall Chest Tower, Storage Organizer Units for Clothing, Closet, Fabric Bins",0.0,42.98,0,100,-inf
162,White Bright 4 Drawer Shoe Cabinet Shoe-shelf Furniture Shoes Organizer Shoerack Living Room Cabinets Rack Home,0.0,104.75,1,100,-inf
163,"Patio Furniture Outdoor Set, Terrace Sofa Set, All-weather PE Rattan with Padded Cushions, Garden Furniture Sets",665.74,393.44,16,100,40.9018535764713
164,"Patio Furniture Set, 7 Pieces Outdoor Patio Furniture with Dining Table&Chair, All Weather Wicker Conversation Set with Ottoman",0.0,387.73,1,100,-inf
165,3 Lighting Colors Home Furniture for Bedroom Makeup Vanity Desk With Lights and 4 Drawers Vanity Table Set Large Size 39.4in(L),0.0,181.94,0,100,-inf
166,"7 Pieces Patio Furniture Set, Outdoor Sectional Sofa Conversation Set, All Weather Wicker Rattan Couch Dining Table & Chair",0.0,432.98,1,100,-inf
167,"Sofa with 2 seats, Modern Velvet Sofa Accent Upholstered Settee, 2 Seater Small Loveseat for Small Spaces, Living Room Furniture",0.0,225.19,1,100,-inf
168,Adjustable Mid Back Mesh Swivel Office Chair With Armrests Black Computer Armchair Furniture Chairs Gaming Cheap Cushion,0.0,42.83,9,100,-inf
169,Sofa Futon - Premium Upholstery and Wooden Legs - Light Bluefreight Free Living Room Sofas Furniture Home,0.0,298.14,0,100,-inf
170,LED Nightstands Set of 2 Modern End Table with 2 Drawers End Tables for Living Room Bedroom furniture bedroom night stand,0.0,141.47,3,100,-inf
171,Night Stand Set 2 With Charging Station Furniture Black Nightstand Set of 2 With LED Lights Bedside Tables for the Bedroom Table,0.0,157.25,2,100,-inf
172,Patio Furniture Set 4-Piece Outdoor Rattan Wicker Sofa Set with Cushions & Coffee Table with Tempered Glass Table Top,0.0,339.1,0,100,-inf
