,productTitle,originalPrice,price,sold,tagText,Discount_percentage
516,Wardrobe Storage Bag Clothing Bedroom Furniture Wardrobe Collapsible Portable Suspension Cupboard Dormitory Wardrobe Hot E12171,14.31,8.31,2,100,41.92872117400419
517,Dresser for Bedroom with 12 Drawers Tall Dressers & Chests of Drawers for Bedroom Dresser for Closet Wooden Top & Metal Frame,0.0,105.55,1,100,-inf
518,140cm Living Room S Shape Inflatable Sofa Minimalist Single Lazy Couch Reading Ergonomic Divano Furniture Cheap Sofas In Offers,0.0,37.89,16,100,-inf
519,Nordic Metal Makeup Stool Office Gardening Dressing Bar Vanity Chair Living Room Sillas Para Sala De Estar Home Furniture,0.0,26.95,2,23,-inf
520,Headboards Portable Shoe Rack Organizer Shoerack Chairs for Living Room Cabinets Home Furniture Shoe-shelf Chaise Lounge Canopy,13.95,7.95,57,100,43.01075268817204
521,"Modern Fluted Door Kitchen Storage Sideboard Buffet Cabinet Console, durable laminate, and smooth, painted metal，69 Inch",0.0,398.3,0,100,-inf
522,Shoe Storage Rack Bench With Double Layer Cushion Seat Living Room Shoe Organizer Entryway Storage Hallway Furniture Shoe Stool,0.0,34.2,35,14,-inf
523,Portable Inflatable Sofa Bed S-shaped Love Position Labor-saving Sitting Wedge Husband Wife Pillow Better Love Life Furniture,0.0,44.69,23,67,-inf
524,DIY Multilayer Shoes Rack Steel Tube Shoe Cabinet Hallway Entryway Storage Rack Space Saving Stand Holder Living Room Furniture,24.91,18.91,60,100,24.08671216378964
525,"SONGMICS Ottoman Storage Bench, 35 Gal. Folding Chest with Breathable Linen-Look Fabric, Holds 660 Lb, for Entryway, Living Room",0.0,56.86,0,100,-inf
526,Home Furniture Shoerack Shoe Rack Organizer Cabinets for Living Room Belt Women Luxury Brand Vip Bag Shoe-shelf Cabinet Shoes,0.0,11.69,33,64,-inf
527,Creative Home Decor Art Abstract Sofa Side Table Light Luxury Living Room Porch Decoration Corner Table Designer Furniture,0.0,45.94,53,86,-inf
528,Multi-ayer Shoe Rack DIY Clothes Hanger Coat Rack Storage Clothing Drying Rack Shoe Organizer Home Dorm Furniture Hat Hangers,55.77,25.27,147,100,54.688900842747
529,Nnewvante Sofa Side End Table with Wheels/Casters Couch TV Laptop Desk Snack Tray for Living Room Bedroom Small Spaces,0.0,69.03,0,100,-inf
530,Nordic Hotel Dormitory Leisure Dining Chairs Simple Small Apartment Backrest Armchair Home Furniture Bedroom Girl Dressing Chair,0.0,79.98,6,35,-inf
531,Wooden Mobile Floor Coffee Table Round Center Couch Table Hallway White Low Articulos Para El Hogar Furniture Living Room,0.0,86.73,4,100,-inf
532,Hallway Ottoman Living Room Furniture Minimalist Storage Pouf Footstool Shoe Changing Pouf Thickened Plastic Waiting Stool,0.0,13.8,52,74,-inf
533,"Small Bar Table and Chairs Tall Kitchen Breakfast Nook with Stools/Dining Set for 2, Storage Shelves, Space-Saving, Retro",0.0,63.0,0,100,-inf
534,Nordic Coffee Table Modern Simplicity Sofa Side Table Removable Balcony Metal Table C-Shaped Corner Table Home Furniture,0.0,11.47,9,12,-inf
535,Nordic Tempered Transparent Glass Coffee Tables Living Room Small Apartment Luxury Minimalist Tea Table Hall Design Furniture,0.0,94.9,23,100,-inf
536,Cabinet Shoe Cabinets Living Room Cabinets Entrance Furniture Ultra-thin Dump Shoe Rack Kitchen Cupboards Shoe-shelf Shoerack,41.84,35.84,58,100,14.340344168260035
537,"FABATO Lift Top Coffee Table, 4-in-1 Multi-Function Convertible Coffee Table with Storage, Coffee Table Converts to Dining Table",0.0,180.96,0,100,-inf
538,Living Room Chairs Acrylic Transparent Fashion Folding Chairs Coffee Shop Modern Simple Chairs Household Lounge Chairs Furniture,0.0,55.23,18,65,-inf
539,Bamboo Shoe Cabinet Shoes Organizers Plastic Space Saving Shoe Rack Shoerack Shoe-shelf Chessure Furniture Cabinets Cupboards,34.41,34.41,25,100,0.0
540,Shoes Organizer Shoe Stool Mdf Shoe Rack Organizers Garden Furniture Sets Shoerack Shelving Cabinets for Living Room Shoe-shelf,20.95,16.45,171,100,21.479713603818617
541,"HLR Round Coffee Table with Green Faux Marble Top Living Room Furniture 31.5""D 31.5""W 18""H US",0.0,121.39,0,100,-inf
542,Storage Drawer Drawers Plastic Organizer Cabinet Box Closet Unit With Type Desktop Shelf Stacking Furniture Bins Chest Layer,21.24,15.24,40,100,28.248587570621464
543,Stackable Shoe Rack Space Saving Shoerack Organizer for Entry Door Multi-Layer Plastic living room Cabinet Furniture,12.85,8.35,44,100,35.01945525291829
544,Rocking Chair Reclining Chair Adult Living Room Home Single Lounge Lazy Sofa Lobster Snail Chair Furniture كرسي استرخاء,0.0,207.36,4,100,-inf
545,"Courtyard patio furniture set, 4-piece outdoor patio set with sofa, removable & washable deep seating cushion, tempered glass Ta",0.0,501.86,0,100,-inf
546,Home Furniture Storage Cabinet Office Chairs for Living Room Shoerack Shoe Organizer Rack Chaise Lounge Shoe-shelf Canopy Shoes,22.17,16.17,46,100,27.06359945872801
547,Shoe Rack Organizer Luxury Brand Bags Leather Bag Luxury Designer Cabinets for Living Room Cabinet Shoe-shelf Furniture Shoerack,0.0,27.96,40,64,-inf
548,Plastic Space Saving Shoe Rack Bamboo Shoe Cabinet Shoes Organizers Shoe-shelf Chessure Furniture Shoerack Cabinets Cupboards,31.24,31.24,29,100,0.0
549,The iconic design of the bedside table industrial farmhouse 2 drawer bedside table with meat chunks brown and black,0.0,232.42,0,100,-inf
550,2022Rotary Shoe Cabinet Plastic Shoe Holder Chessure Furniture Shoe-shelf Shoes Organizer Shoerack Rack Cabinets Cupboards Stool,0.0,33.85,21,60,-inf
551,Garden Furniture Sets Office Chairs for Living Room Chaise Lounge Shoes Organizer Shoe-shelf Coffee Tables Shoerack Headboards,0.0,13.61,37,64,-inf
552,Small Home Furniture End Tables Decor The Side Night Stands Pvc Wood Plastic Board Bedroom Storage Shelf,18.37,18.37,6,100,0.0
553,"Rattan Cabinet, Adjustable Shelves，Sideboard Buffet Storage Cabinet with Doors & Drawers for Dining Room Living Room",0.0,184.07,1,100,-inf
554,Shoes Organizer Leather Bag Luxury Designer Bags Cabinets for Living Room Furniture Shoerack Luxury Clothes Women Shoe-shelf,0.0,31.38,31,64,-inf
555,Wardrobe Folding Portable Clothing Storage Cabinet Non-Woven Dustproof Simple Steel Assembly Closet Multipurpose Furniture,0.0,118.53,19,100,-inf
556,2024 Newest Outdoor Patio Dining square table Chairs Metal cast aluminium Round Table Furniture for Garden Yard,0.0,103.38,6,43,-inf
557,"VOCIC Lightweight Electric Lift Chair, Lift Elderly from Floor, Lift Assist Devices, 6 Suction Cups, Foldable and Detachable",0.0,292.92,0,100,-inf
558,Creative Cubic Imitation Lamb Wool Funny Shoes Stool Bedroom Decorative Dices Stool Living Room Mobile Furniture Home Decoration,20.79,14.79,41,100,28.860028860028862
559,Vabches Padded Shoe Storage Bench with Flip Drawer&Side Cabinet Adjustable Shelf Shoerack Shoe Cabinet for Living Room Furniture,0.0,99.22,0,100,-inf
560,"5-Drawer Chest with 1 Door, Wooden Chest of Drawers Storage Cabinet with Wheels, Office Organization and Storage,Furniture Black",0.0,104.34,0,100,-inf
561,Living Room Home Furniture Hall / Metal Drawer Pulls Bedside Table Sofa Couch Shabby White Freight Free Bedroom,0.0,129.95,0,100,-inf
562,"PrimeFurnish Secret Compartment Furniture Hidden Compartment Nightstand for Bedroom Living Room, Mid Century Concealment Furnit",0.0,171.08,0,100,-inf
563,"East West Furniture DLML3-MAH-W 3 Piece Modern Set Contains with Dropleaf and 2 Kitchen Dining Chairs, 42x42 Inch",0.0,248.08,0,100,-inf
564,"Prepac Monterey Bedroom Furniture: White Double Dresser for Bedroom, 6-Drawer Wide Chest of Drawers, Traditional Bedroom Dresser",0.0,141.53,0,100,-inf
565,"1828823 outdoor storage furniture, small, Sandstone",0.0,38.23,0,100,-inf
566,"Montlake Water-Resistant 48x18x3 Inch Outdoor Bench/Settee Cushion, Patio Furniture Swing Cushion, Heather Indigo Blue, Pati",0.0,44.61,0,100,-inf
567,"Patio Furniture Sets, 6 Pieces Couch Outdoor Chairs Coffee Table Peacock Blue Anti-Slip Cushions, Outdoor Furniture Sets",0.0,1068.5,0,100,-inf
568,"VEVOR Upholstered Bench 16""W Ottoman with Foam Padded Cushion and Rubberwood Legs Tufted Footrest Stool Entryway Bench for Room",0.0,68.8,0,100,-inf
569,Bar Stools Modern PU Leather Adjustable Swivel Barstools Dining Chairs Black Kitchen Chair 4 Pcs) Home Furniture Room,0.0,119.78,0,100,-inf
570,Vabches Vanity Desk with Mirror&Lights Wooden Storage Makeup Table Bedroom Furniture with 5 Drawers Vanity Set with Power Outlet,0.0,156.35,0,100,-inf
571,"Vabches Vanity Desk for Makeup Wood Dressing Table for Bedroom Furniture with Storage Stool,Power Strip & 3 Modes Lighted Mirror",0.0,112.04,0,100,-inf
572,"Console Table, Small Entryway Table with Storage Shelves 12'' Narrow Sofa Table Modern Hallway Table",0.0,51.3,0,100,-inf
573,"5Pc Patio Furniture Set, Outdoor Rattan Chairs with Metal Coffee Table, Ottomans & Soft Cushions, Wicker Conversation Bistro Set",0.0,169.56,0,100,-inf
574,"Ravenwater-resistant 76 inch patio sofa/loveseat cover, patio furniture covers",0.0,41.42,0,100,-inf
575,Free Shipping Chair Black Steel Folding Chair (4 Pack) Dining Chairs Living Room Chairs Foldable Floor Garden Furniture Home,0.0,54.66,0,100,-inf
576,"Dresses 10 Drawers, Bedroom Chest of Drawers with Side Pockets and Hooks, Sturdy Steel-framed Vanity, PU Storage Dresses",0.0,86.94,0,100,-inf
577,"3-Seater Sofa Couch, Living Room Furniture, Green Velvet",0.0,228.06,0,100,-inf
578,"8pcs Wicker Patio Furniture Set, 4 x Single Chair, 2 x Glass Top Coffee Table, 2 x 2-Seat Lover Sofa, All Cushioned Outdoor Set",0.0,843.86,0,100,-inf
579,Vanity Dressing Table Set Wooden Modern With Pivoting Mirror and Stool Free Shipping Dressers for Bedroom White Furniture,0.0,136.02,0,100,-inf
580,Cafe Sofa And Loveseat Set,0.0,1301.71,0,100,-inf
581,Computer Desk with Drawers & Armless Desk Chair with Wheels Home Office Furniture Set,0.0,110.84,0,100,-inf
582,"3 Seat Reception Chairs, Office Guest Chairs Waiting Furniture Bench Seating for Airport, Bank, Hospital, Salon",0.0,122.35,0,100,-inf
583,Bush Furniture Key West 54W Computer Desk with 2 Drawer Lateral File Cabinet and 5 Shelf Bookcase in Washed Gray,0.0,691.82,0,100,-inf
584,"5-Piece Wicker Patio Furniture Set, Outdoor Set, Sectional Sofa with Water Resistant Thick Cushions and Storage Table (Beige）",0.0,357.72,0,100,-inf
585,Space Saving Corner Desk and End Table Espresso/Black Furniture Set,0.0,56.44,0,100,-inf
586,Small Dressers & Chests of Drawers Toilet Furniture Makeup Table Furnitures Dresser With 4 Storage Drawers Dressers for Bedroom,0.0,48.1,0,100,-inf
587,"L: 22.13"" X W: 17.56"" X H: 25.71"" Bedside Table Nightstands Bedroom Furniture Home",0.0,119.73,0,100,-inf
588,Storage Cabinet Wooden Bathroom Floor Cabinet Small Space Furniture White Side Storage Organizer with 4 Drawers and 1,0.0,55.86,0,100,-inf
589,"Step2 Vero Pool Lounger, Fade-Resistant, Waterproof Patio Furniture, Pool Lounge Chair for Sun Shelf",248.93,185.2,1,100,25.601574739886722
590,"3 Pieces Patio Furniture Set, Outdoor Swivel Glider Rocker, Wicker Patio Bistro Set with Rocking Chair, Cushions and Table (Red)",0.0,375.38,1,100,-inf
591,Poolside Garden Furniture Sets Black PE Wicker Furniture Sets Backyard 5 Pieces Outdoor Patio Sectional Sofa Couch Free Shipping,0.0,421.21,1,100,-inf
592,"Neilsville Industrial 6 Drawer Dresser, Butcher Block Gray",0.0,195.89,0,100,-inf
593,"Shintenchi Outdoor Patio Furniture 4 Piece Set, Wicker Rattan Sectional Sofa Couch with Glass Coffee Table | Brown",0.0,268.84,0,100,-inf
594,V50i Extra Large Portable Closet Rack Bedroom Freestanding Wardrobe Closet Max Load 1300lbs Bathroom Furniture Organizer Room,0.0,181.94,0,100,-inf
595,5 Qt. (1.25 gal.) Small Stackable Plastic Closet Storage Box Clear Set of 20 bedroom furniture organizer Stackable design allows,0.0,33.92,0,100,-inf
596,"BORNOON Wood Shoe Cabinet with 3 Flip Drawers, Hidden Shoe Storage Cabinet for Entryway,Freestanding Shoe Rack Storage Organizer",0.0,123.89,3,100,-inf
597,1PC Mini House Night Table Model Wooden Mini Bedside Table Model Decoration Furniture,4.94,0.99,7,100,79.95951417004048
598,"YITAHOME 4-Piece Patio Furniture Wicker Outdoor Bistro Set, All-Weather Rattan Conversation Loveseat Chairs for Backyard",0.0,254.28,0,100,-inf
599,Shintenchi 3 Pieces Patio Furniture Set 3 Pieces PE Rattan Wicker Chairs with Table Outdoor Furniture for Backyard/Garden,0.0,121.94,0,100,-inf
600,"Shoe Cabinet with 3 Flip Drawers, Shoe Storage Organizer with 2-Tier Shelf for Entryway, Freestanding Shoe Rack Storage",0.0,74.51,0,100,-inf
601,"Outdoor Patio Canopy Round Daybed with Washable Cushions, Clamshell Sectional Seating Wicker Furniture with Retractable Canopy",0.0,329.84,0,100,-inf
602,"Nightstand Set of 2, Nightstand for Bedroom with Drawers, Small Dresser with Drawers, Bedside Table Bedside Furniture",0.0,51.92,0,100,-inf
603,Crosley Furniture Kiawah Outdoor Wicker Table with Glass Top - Brown,0.0,72.6,0,100,-inf
604,"8 Pieces Outdoor Wicker Rattan Patio Furniture Sectional Set,Glass Top Table Hidden Storage,7 Sofa Sections, Oversized Cushions",0.0,534.86,5,100,-inf
605,Mainstays Farmhouse Rectangle Coffee Table Black Living Room Furniture Living Room Furniture,0.0,51.16,0,100,-inf
606,Easyfashion Faux Leather Upholstered Barrel Club Chair Brown Living Room Furniture Single Sofa Chair Minimalist Sofa,0.0,73.74,0,100,-inf
607,L Modern Bedroom Bedside Table Nightstands Minimalist Bedside Table Nightstands Storage Drawers Children Furniture,0.0,45.65,1,82,-inf
608,Folding Half Portable Foldable Table for Parties Backyard Events,0.0,75.25,0,100,-inf
609,Storage Ottoman Foot Stool Dark Teal Freight Free Hallway Living Room Furniture Home,0.0,147.92,0,100,-inf
610,"3 Pieces Rocking Wicker Bistro Set, Patio Outdoor Furniture Conversation Sets with Porch Chairs and Glass Coffee Table, Beige",0.0,141.05,1,100,-inf
611,Dressers for Bedroom Furniture Office Organization and Storage Furnitures 7 Drawer) Vanity Desk Dressing Table 5/7 Drawer Chest,0.0,90.03,9,100,-inf
612,"5-Piece Dining, Farmhouse Set-Extendable Round Table and 4 Upholstered Chairs for Kitchen, Living Room, Natural Wood Wash",0.0,540.91,0,100,-inf
613,Easy Pull Handle (White) Dressing Table Closets Dresser for Bedroom Furniture Fabric Storage Dressers Drawers for Bedroom Vanity,0.0,84.33,0,100,-inf
614,"4 Pieces Patio Furniture Sets Rattan Chair Wicker Conversation Sofa Set, Outdoor Indoor Backyard Porch Garden Poolside Use",0.0,266.69,0,100,-inf
615,"4 Piece Patio Furniture Set, Outdoor Wicker Conversation Sets,Rattan Sectional Sofa w/Coffee Table, for Backyard Garden Poolside",0.0,161.59,2,100,-inf
616,Orange Accent Chair Set of 2 Upholstered Living Room Chairs Modern Bedroom Furniture Sets Armless,0.0,125.55,0,100,-inf
617,Living Room Cabinets Cheap Shoes Shoe-shelf Sneaker Mid-century Furniture Organizer Shoe Rack Folding Shoerack Shoemakers Home,35.68,33.18,64,100,7.006726457399102
618,Home Furniture Shoerack Coffee Tables Headboards Office Chairs for Living Room Cabinets Storage Cabinet Shoe Organizer Rack Bar,26.39,20.39,49,100,22.735884804850322
619,Home Furniture Storage Cabinet Office Chairs for Living Room Shoerack Shoe Organizer Rack Chaise Lounge Shoe-shelf Canopy Shoes,22.73,18.23,45,100,19.79762428508579
620,"78'' White Couches for Living Room, Sofa 3 Seater Sofa with 2 Throw Pillows and Gold Metal Legs, (Cream White)",0.0,312.9,0,100,-inf
621,Dressers for Bedroom Furniture Office Organization and Storage Furnitures 7 Drawer) Vanity Desk Dressing Table 5/7 Drawer Chest,0.0,87.83,0,100,-inf
622,"3 Pieces Patio Wicker Furniture Set, Rattan Outdoor Sofa Set w/Washable Cushion & Acacia Wood Coffee Table, for Garden Backyard",0.0,196.09,0,100,-inf
623,"Outdoor Dining Set,With Waterproof Upholstered CushionStackable Armrest Chairs, 9 Piece Outdoor Garden Furniture Set",0.0,571.49,3,100,-inf
624,"Portable Closet, Wardrobe Closet with 10 Storage Shelves and 2 Hanging Rods, Non-Woven Fabric Cover,Closet Organizer Wardrobes",0.0,33.35,12,100,-inf
625,TV Stand Metal TV Table With Storage Steel 3 Door Locker Cabinet for Living Room (Black) Freight Free Furniture Home,0.0,109.69,2,100,-inf
626,Makeup Vanity Table Set Glass Top Makeup Vanity Table With 10x Magnifying Mirror 3 Light Settings (Modern White) Furnitures Desk,0.0,206.12,5,100,-inf
627,"Bathroom Floor Storage Cabinet, Bathroom Storage Unit with 2 Adjustable Shelves, Freestanding Home Furniture, Bathroom Cabinet",0.0,88.64,0,100,-inf
628,"Vanity Desk with LED Lighted Mirror & Power Outlet, Makeup Table with Drawers & Cabinet,Storage Stool,for Bedroom, White",0.0,260.34,0,100,-inf
629,"Garden Furniture 7 Piece Patio Set, Sectional PE Rattan Furniture Patio Sets with Cushions and Glas Coffee, Garden Furniture Set",0.0,461.3,0,100,-inf
630,"2024 New Outdoor Rocking Chair, 3 Piece Porch Chairs, Brown Rattan Furniture Sets with Coffee Table",0.0,133.38,0,100,-inf
631,"3Pcs Patio Bistro Set,Wood Folding Table Sets,2 Cushioned Chairs for Garden Yard,Outdoor Furniture Round Table (Natural & Beige)",0.0,109.78,0,100,-inf
632,"Entryway Table, 38'' Console Sofa Table with 3 Fabric Drawers, Industrial Entry Way Table with Storage Shelves",0.0,47.07,0,100,-inf
633,"7 Piece Outdoor PE Wicker Furniture Set, Patio Gray Rattan Sectional Sofa Couch Adjustable Gas Fire Pit Dark Blue Cushions",0.0,549.07,0,100,-inf
634,"Living Room Accent Chair, Modern High-back Armchair, Gray Plaid Chair, Home Furniture Minimalist Fabric Living Room Chair",0.0,85.58,0,100,-inf
635,Steel Frame Dressers for Bedroom Furniture Fabric Storage Dresser With Storage Drawers Vanity Desk Closet Makeup Table Wood Top,0.0,74.54,2,100,-inf
636,"TV Stand Industrial Entertainment Center, Rustic Grey",0.0,114.08,0,100,-inf
637,Accent Bedside End Side Table With Storage Drawer Nightstands and Mid-Century Modern Legs for Living Room or Bedroom Furniture,0.0,122.36,0,100,-inf
638,Modern High Gloss Entertainment Center for TVs Up to 70” Tv Stand With Drawers and Storage Cabinet Living Room Furniture Home,0.0,125.41,1,100,-inf
639,"Patio Furniture Set, 7 Pieces Modular Outdoor Sectional, Wicker Patio Sectional Sofa, Brown Rattan(Beige Cushions)",0.0,377.99,8,100,-inf
640,"Living Room Sofa, Deep Seat Oversize Sofa, 83-Inch 3 Seat Couch with Upholstered, Pet-Friendly Tufted Fabric Couch, Beige",0.0,648.93,1,100,-inf
641,"Garden Furniture Set 7 PCS, Garden Fire Pit Table Patio Sets, No-Slip Cushions and Waterproof Covers, Garden Furniture Set",0.0,925.33,1,100,-inf
642,7 Pieces Outdoor PE Wicker Furniture Set Patio Rattan Sectional Conversation Sofa Set with Khaki Cushions and Glass Top Table,0.0,499.63,10,100,-inf
643,"8 Seating Outdoor Patio Furniture Sectional Sofa Set,All-Weather Half-Moon with Tempered Glass Table for Backyard Porch Poolside",1154.41,686.65,4,100,40.51939952010118
644,31.5in(L)… Home Furniture Luxury Cute Vanity Makeup Table Vanity Desk With Mirror and Lights 3 Lighting Modes Dresser Furnitures,0.0,161.81,0,100,-inf
645,Furniture Shoe Cabinet with 2 Flip Drawers 2-Tire Shoe Storage Cabinet for Entryway,0.0,89.38,0,100,-inf
646,Makeup Vanity Organizer Makeup Vanity Desk With Mirror and Lights Dressers for Bedroom Furniture 5 Drawers & Storage Bag Dresser,0.0,182.76,3,100,-inf
647,"Progressive Furniture Foxfire Nightstand, 26"" W x 16"" D x 28"" H, Black",0.0,288.38,0,100,-inf
648,"2024 New 65.1''Loveseat Sofa Couch for Living Room, Modern Sofa,Small Couches for Small Spaces",0.0,174.44,5,100,-inf
649,"Meridian Furniture Cresthill Collection Mid-Century Modern Nightstand, 24"" W x 18"" D x 23"" H, Black Oak",0.0,392.16,0,100,-inf
650,"New Classic Furniture Sapphire Nightstand, White",0.0,239.85,0,100,-inf
651,"Global Furniture USA Nightstand, White",0.0,161.65,0,100,-inf
652,"Mid Century Modern Velvet Upholstered Tufted Living Room Sofa, 69.68"", Prussian Blue",0.0,253.15,0,100,-inf
653,Makeup Vanity Desk Set Pearl-White 3 Color Lighting Modes Make Up Table Makeup Vanity With Large Lighted Mirror Furnitures Light,0.0,193.13,0,100,-inf
654,Dressing Table for Bedroom Furniture Home 4 Cabinets & Time Display Makeup Vanity Table Set Vanity Desk With Mirror and Lights,0.0,203.08,2,100,-inf
655,Makeup Table Makeup Vanity With Lights Make Up Table 2 Cabinets & Long Storage Shelf Furniture Bathroom 10 Led Lights White Desk,0.0,162.46,2,100,-inf
656,"Luxury Modern Tight Curved Back Velvet Sofa,Minimalist Style Comfy Couch For Living Room,L-Shape Left Chaise Room Furniture",0.0,2876.38,0,100,-inf
657,"Patio Furniture Set, Outdoor Swivel Glider Rocker, Wicker Bistro Set with Rocking Chair, Thickened Cushions and Table for Porch",0.0,290.55,1,100,-inf
658,"3 Piece Outdoor Patio Conversation Furniture Set with 2 Rockers and 1 Metal Table with Thick Cushions for Backyard,Poolside",0.0,452.07,0,100,-inf
659,"3 Pieces Rocking Wicker Bistro Set, Patio Outdoor Furniture Conversation Sets with Porch Chairs and Glass Coffee Table, Beige",0.0,111.68,1,100,-inf
660,Farmhouse 8-Drawer Dresser - Grey Chest of Drawers for Bedroom and Living Room Organization,0.0,235.31,0,100,-inf
661,"5-Piece Patio Furniture Sets Wicker Furniture Set, Outdoor Conversation Sectional with Ottoman for Backyard Poolside, Garden",0.0,186.94,1,100,-inf
662,"Round Wood Coffee Table - 31.5"" Farmhouse Natural Circle Wooden 2-Tier Coffee Tables Living Room Furniture,",0.0,198.69,0,100,-inf
663,Elegant White Shoe Storage Cabinet Space-Saving Solution With Cubbies for 36 Pairs Shoes Organizer Living Room Furniture Home,0.0,155.98,0,100,-inf
664,"Modway Juliana Performance Velvet Upholstered Sofa, Dusty Rose living room furniture sofa couch casa prefabricada sofa chair",0.0,443.05,0,100,-inf
665,"Patio Furniture Sets 5 Pieces Outdoor Wicker Conversation Set Sectional Sofa Rattan Chair,Furniture with Coffee Table,Red",0.0,336.99,1,100,-inf
666,LEEGOHOME Wardrobes Closet Cloth Bedroom Furniture 85/125/166/207x45x170cm 26mmSteel Pipe Support Storage Household,48.79,21.43,31,100,56.07706497233039
667,Dressers for Bedroom Furniture Thickened Frame Dresser Vanity Table for Makeup Furnitures Hallway Kids Room Make Up Table Toilet,74.05,42.93,13,100,42.025658338960156
668,"16 Drawers Dresser for Bedroom, Tall Dressers & Chests of Drawers with Wood Top, Large Fabric Storage Dresser,Black",0.0,117.1,1,100,-inf
669,"Patio Furniture Sets All-Weather Conversation Set Outdoor Wicker Sectional Sofa Chair w/ Cushion & Coffee Table,Multiple Colors",0.0,148.24,29,100,-inf
670,"REDLIFE Vanity Stool Chair with Storage Faux Fur Makeup Ottoman, Dresser Furniture with Gold Metal Legs for Bedroom & Livingroom",53.87,26.32,7,100,51.1416372749211
671,LEEGOHOME Wardrobes Closet armario Cloth Bedroom Furniture 85/125/166/207x45x170cm Steel Pipe Support Storage Household,0.0,23.37,9,100,-inf
672,MINGDIBAO Fabric Sofa Set Furniture Living Room Sofa Set with USB and Stools / Big U Shape Cloth Couch Sofas for Home Furniture,0.0,1274.15,25,100,-inf
673,Shoe-shelf Chairs for Living Room Cabinets Shoe Organizer Rack Garden Furniture Sets Headboards Chaise Lounge Shoerack Canopy,0.0,26.38,95,64,-inf
674,Simple Metal Shoe Rack Space Saving Stand Holder Hallway Entryway Shoe Organizer Living Room Furniture Modern Shoe Cabinets2021,21.89,21.89,63,100,0.0
675,"Sideboard Buffet Kitchen Storage Cabinet with Rattan Decorated Doors, Dining Room, Cupboard Console Table, Accent Cabinet",0.0,114.1,2,100,-inf
676,Makeup Vanity Table Set Glass Top Makeup Vanity Table With 10x Magnifying Mirror 3 Light Settings (Modern White) Furnitures Desk,0.0,213.23,1,100,-inf
677,Makeup Vanity Desk Set Pearl-White 3 Color Lighting Modes Make Up Table Makeup Vanity With Large Lighted Mirror Furnitures Light,0.0,193.13,0,100,-inf
678,Makeup Vanity Organizer Makeup Vanity Desk With Mirror and Lights Dressers for Bedroom Furniture 5 Drawers & Storage Bag Dresser,0.0,182.76,1,100,-inf
679,"Nightstands End Table X-Design with Drawer and Storage Shelf for Living Room Bedroom, Set of 2, Classic Orange",0.0,73.42,0,100,-inf
680,"3 Pieces Patio Wicker Furniture Set, Rattan Outdoor Sofa Set w/Washable Cushion & Acacia Wood Coffee Table, for Garden Backyard",0.0,265.11,3,100,-inf
681,Dressing Table for Bedroom Furniture Home 4 Cabinets & Time Display Makeup Vanity Table Set Vanity Desk With Mirror and Lights,0.0,191.52,0,100,-inf
682,7 Pieces Outdoor PE Wicker Furniture Set Patio Rattan Sectional Conversation Sofa Set with Khaki Cushions and Glass Top Table,0.0,458.0,3,100,-inf
683,"WOHOMO Coffee Table, Modern Style Coffee Tables for Living Room Marble Center Table with Storage 2 in 1Detachable Table Set",0.0,71.62,2,100,-inf
684,"Patio Furniture Set, 7 Pieces Outdoor Patio Furniture with Dining Table&Chair, All Weather Wicker Conversation Set with Ottoman",2487.65,491.53,9,100,80.24119148594055
685,"9 Piece Outdoor Dining Set, Garden Patio Wicker Set w/Cushions, Furniture with Acacia Wood Table and Stackable Armrest Chairs",0.0,470.64,0,100,-inf
686,"Outdoor Furniture Replacement Cushions, Fits Sectional Rattan Conversation Set, Patio Sofa Cushions, Loveseat Cushion Set",0.0,159.41,10,100,-inf
687,"Sideboard Buffet Cabinet, Storage Cabinet with Rattan Doors, with Metal Base and Adjustable Shelves Accent Cabinet Credenza",0.0,139.4,0,100,-inf
688,Makeup Vanity Desk Set Pearl-White 3 Color Lighting Modes Make Up Table Makeup Vanity With Large Lighted Mirror Furnitures Light,0.0,186.69,0,100,-inf
689,"Modern furniture, simple custom furniture",0.0,1.04,112,100,-inf
690,Sofa Side Table End Table Bedroom Side Table Coffee Table Home Furniture,26.22,14.7,3,100,43.93592677345538
691,7 Pieces Sectional Sofa Patio Furniture Sets Manual Weaving Wicker Rattan Patio Conversation with Cushion and Glass Table(Beige),688.21,386.28,1,100,43.871783321951156
692,"Modern furniture, simple custom furniture",0.0,1.01,15,100,-inf
693,Portability Foot Rest Under Desk Footrest Ergonomic Foot Stool with Massage Rollers Foot Rest for Home Office Work Fast Ship,18.32,5.0,900,100,72.70742358078603
