,productTitle,originalPrice,price,sold,tagText,Discount_percentage
1047,Creative Dice Chair Stool Fashionable Thickened Dice Rubik's Cube Stool Entrance Shoe Replacement Living Room Sofa Stool,26.92,9.07,2,100,66.3075780089153
1048,Large Shoe Organizer Cabinet 9-Tier 40-46 Pairs Sneaker Holder with Dustproof Cover and Zipper High-Quality PP Sheets Shoe Rack,0.0,30.78,6,100,-inf
1049,"Dresser,15.7""D x 31.5""W x 35""H 35"" H Farmhouse Black Rattan , Polished,3 Drawer with Natural Rattan Spacious Chest of Drawers",0.0,174.09,1,100,-inf
1050,"Nightstands Set of 2 with LED Lights and Charging Station,End Table with 2 Fabric Storage Drawers and Shelves, Modern Side Table",0.0,62.75,2,100,-inf
1051,Dresser for Bedroom With 8 Drawer Dressing Table TV Stand Dressers Chest of Drawers for Living Room Hallway Entryway White the,313.14,181.88,5,100,41.91735326052245
1052,"Egg Swing Chair with Stand, Rattan Wicker Hanging Egg Chair for Indoor Outdoor Bedroom Patio Hanging Basket Chair Hammock",0.0,117.79,13,100,-inf
1053,"Simple Design 2-Pack End Table Set Espresso Marble Pattern High Quality Rounded Corner Safe Fit Budget Space 20""x20""x19.6""",0.0,31.51,1,100,-inf
1054,1PC Portable Wardrobe Closet Heavy Duty Hanger Freestanding Closet Metal Hanger with 4 Hanging Rods Adjustable Wardrobe Shelf,14.13,7.92,0,100,43.94904458598726
1055,"Gurexl 3 in 1 Vanity Desk with Human Sensor LED Light,Tall Makeup Vanity Set with 2 AC Outlets & USB-C,Make Up Vanity Desk",0.0,188.7,1,100,-inf
1056,"Set of 2 Mid Century Nightstand with Charging Station, End Table Modern Side Table One Drawer",0.0,41.57,3,100,-inf
1057,"Bed Couch Memory Foam Convertible Modern Sleeper Sofa with Adjustable Armrests and Metal Legs, Grey Sofabed",0.0,155.43,3,100,-inf
1058,"Modern LED TV Stand for Televisions up to 70 Inch with Glass Shelves and Drawer, Gaming Entertainment Center with Multiple",0.0,112.72,35,100,-inf
1059,"Gaming Chair, Office High Back Computer Chair Leather Desk Racing Executive Ergonomic Adjustable Swivel Task Chair",0.0,85.85,28,100,-inf
1060,"5-Drawer Chest for Bedroom, Black, 16"" D x 31.5"" W x 45.25"" H",0.0,128.0,6,100,-inf
1061,Bedroom Nightstands Wooden Night Stands with Rattan Weaving Drawer Home Bedside End Table for Storage,0.0,39.3,2,100,-inf
1062,Modern 2-Tier Round End Table with Storage Shelf Faux Marble Top Gold C-Shaped Legs Sofa Side Table,0.0,41.18,14,100,-inf
1063,"Queen size upholstered bed frame, Queen bed frame with 3 drawers, Queen size bed frame with headboard",482.4,236.7,12,100,50.93283582089553
1064,"Flat Screen TV Stand for 65 75 inch TV, Modern Entertainment Center with Storage Shelves, Media Console Bookshelf for Living",0.0,58.93,5,100,-inf
1065,"Dresser for Bedroom, White Dresser with 6 Wood Large Drawers, Dressers & Chests of Drawers with Large Organizer",0.0,128.12,2,100,-inf
1066,"Metal Storage Locking Cabinet with 4 Doors and 2 Adjustable Shelves,71"" Lockable Garage Tall Steel Cabinet",0.0,129.32,7,100,-inf
1067,"6 Drawer Dresser, Modern White Wide Chest of Drawers with Metal Handels, Wood Double Dresser, Storage Chest Organizers White",0.0,150.81,6,100,-inf
1068,"Tufted Dining Chairs Set of 4, Black Dining Chairs with Nailhead Back and Ring Pull Trim, Velvet Upholstered,Kitchen/Bedroom",0.0,173.29,6,100,-inf
1069,Folding Step Stool Portable Chair Seat For Home Bathroom Kitchen Garden Camping Chair Seat Fishing Household Picnic Chair,30.53,10.79,10,100,64.6577137242057
1070,LEEGOHOME Closet Wardrobe 64in/80in Wardrobe Closet 20mm Fabric for Clothes Hanging with 8/10 Storage Shelves & 4/5 Hanging Rods,0.0,34.22,288,100,-inf
1071,"Vanity Desk with Mirror and Lights, Makeup Corner Vanity with 5 Storage Drawers Shelves and 3 Dimmable Lighting Options and Vani",0.0,143.53,1,100,-inf
1072,"Caterpillar Lazy Sofa, Bedroom, Technology Fabric, Small Unit Living Room, Leisure Chair, Netting Red, Modern Single Person Sofa",0.0,71.15,7,100,-inf
1073,"Office Chair High Back Computer Desk Chair, PU Leather Adjustable Height Modern Executive Swivel Task Chair with Padded",131.54,58.45,7,100,55.56484719476965
1074,"Dresser, Illuminated Mirror, Adjustable Brightness, Dresser with Drawers, Women's Dresser, White Tocadores Para El Dormitorio",351.25,169.62,9,100,51.70960854092527
1075,"White Vanity Desk with Mirror, Lights and Charging Station - Large Makeup Table Set with RGB Cabinets and 3 LED Light Modes",449.93,226.97,14,100,49.55437512501945
1076,King Size Bed Frame with Adjustable Headboard Upholstered Platform Linen Fabric Headboard Wooden Slats Support Grey Bed Frame,0.0,112.56,8,100,-inf
1077,Storage Cabinet with Doors and Shelves Tall Garage Lockable File Heavy-Duty Locker Tool Cabinet for Garage Office Home Kitchen,0.0,70.12,6,100,-inf
1078,European Style Bedside Modern Minimalist Mini Storage Rack Living Room Small Square Table Magazine Table Small Coffee Table,33.2,12.61,50,100,62.018072289156635
1079,"TV Stand for 65 In TV, Modern Entertainment Center w/ Storage Cabinet and Open Shelves,Console Table Media Cabinet,White & Oak",0.0,76.01,9,100,-inf
1080,"Full Metal Platform Bed Frame with Sturdy Steel Beds Slats,Mattress Foundation No Box Spring Needed Large Storage Black BedFrame",0.0,61.88,9,100,-inf
1081,"Wall TV Stand Mounted with LED Lights, Floating Entertainment Center, Floating TVs Shelf with Storage Cabinet, Wall TV Stand",0.0,154.37,4,100,-inf
1082,Office Gaming Chair High Back Leather Computer Chairs Ergonomic Height Adjustable Racing Game Desk Chair Executive Confe,0.0,64.09,27,100,-inf
1083,IHOME Chair Girls Cute Bedroom Dormitory Computer Chair Comfortable Swivel Lift Back Desk Chair Makeup Stool Writing Chair 2024,0.0,26.3,10,96,-inf
1084,LEEGOHOME Shoerack Shoe Organizer Shoe-shelf 2-column 9.8mm Steel Tube Shoe Simple Shoe Rack Dormitory Rental Room Shoe Cabinet,0.0,7.09,1,39,-inf
1085,Movable Computer Table Living Room Bedroom Leisure Side Laptop Desk Table Household Height Adjustable Standing Laptop Desks,51.8,22.49,35,100,56.58301158301159
1086,"32"" Storage Cabinet, Drifted Gray Storage Cabinet, Bathroom Cabinet, Pantry Cabinet with 3 Shelves 16"" D x 32"" W x 65"" H",0.0,132.87,0,100,-inf
1087,"56.5"" W Modern Loveseat 2 Seater Sofa Luxurious Velvet Fabric Couch with Gold-Tone Metal Arms and Legs for Bedroom, Studio Pink",206.95,118.17,11,100,42.89925102681807
1088,"LED TV Stand for Max 70in TV, Gaming Entertainment Center with Drawers and Open Shelves, TV Console Table for Living Room",0.0,121.82,16,100,-inf
1089,Pantry Cabinets White Tall Kitchen Pantry Storage Cabinet Buffet Cupboards Storage Cabinet,0.0,178.33,0,100,-inf
1090,"Sofa SetPaPaJet 112 inch Oversized Sofa, Sectional Sofa with USB Ports, U Shaped Sofa Couch with Storage Chaise, Corduroy Grey",1411.9,841.14,1,100,40.424959274736175
1091,Furinno Turn-N-Tube Handel Stand for TV Up To 55 Inch Espresso Tv Tables for Living Room,0.0,55.21,1,100,-inf
1092,43 Inch Folding Ottoman Storage Bench Hold Up 700lbs Faux Leather with Memory Foam Seat Footrest Padded Upholstered Stool,104.72,44.27,13,100,57.72536287242169
1093,Drawer Table for Bedroom with 6 Drawers Wood Dressers Chest of Drawers with Metal Handles Modern Bedroom Drawer Table,0.0,175.25,4,100,-inf
1094,"Small Folding Storage Ottoman, Foot Rest Stool, Cube Footrest,for Living Room, Bedroom, Home Office, Dorm, Light Gray",0.0,18.01,0,100,-inf
1095,New Wholesale Simple Shoe Rack Multi-layer Space-saving DIY Household Organizer Multi-functional Economic Shoe Storage Racks,10.59,0.99,43,100,90.6515580736544
1096,"White Nightstand with Wireless Charging Station and LED Lights, Modern Bedside Table with Jewelry Storage Drawers,Side End Table",0.0,64.78,2,100,-inf
1097,"Queen Size Bed Frame with LED Upholstered Platform and Storage Drawers, USB Ports, Dark Grey Bed Frame",455.45,197.9,18,100,56.54846854759029
1098,"Egg Swing Chair with Stand, Rattan Wicker Hanging Egg Chair for Indoor Outdoor Bedroom Patio Hanging Basket Chair Hammock",0.0,117.79,10,100,-inf
1099,"Footstool, Foldable Velvet Storage Bench, 2 Extra Storage Boxes, 660 Lb Load Capacity, Storage Ottoman",119.48,53.74,6,100,55.021760964178114
1100,"Modern TV Stand Entertainment Center with Two Storage Cabinets, Retro Style Media Console for Living Room, Bedroom, Office",0.0,72.49,8,100,-inf
1101,"White Nightstand with Charging Station, Small Bed Side Table Fabric Drawer for Spaces, 2 Tiers Storage Shel",0.0,34.94,5,100,-inf
1102,"Memory Foam Futon with Cupholder and USB , Black Faux Leather living room sofa",0.0,172.7,4,100,-inf
1103,"Letaya Metal Storage Cabinets Locker with Lock Door, 72'' Clothing Coat Steel Storage Freestanding Wardrobe for Office, Home",0.0,145.7,5,100,-inf
1104,"Farmhouse 9 Drawers Dresser, Wood Dresser for Bedroom Wide Chest of Drawers, French Country Storage Double Dressers Organizer",580.54,288.77,1,100,50.25838012884556
1105,"6 Drawer Dresser, Modern Wood Dresser for Bedroom with Wide Drawers and Metal Handles, Storage Chest of Drawers ,Dressers",0.0,144.09,9,100,-inf
1106,Shoe Rack Shelves Simple Doorstep Indoor Household Bamboo Storage Small Narrow Wooden Multi-layer Storage in Shoe Cabinet Shelf,0.0,4.15,1,47,-inf
1107,"Elite 32""W x 35""H x 20""D White Wardrobe Closet & Cabinet - Functional Clothes Storage with Hanging Rail",0.0,141.96,2,100,-inf
1108,"43 Inch Folding Storage Ottoman Bench, Holds Up To 660lb-Grey FootRest Stool with Padded Seat",0.0,30.27,4,100,-inf
1109,"Quimoo 48"" Large Vanity Desk with Mirror and Lights, Makeup Vanity with 6 Drawers, Power Outlet, Vanity Makeup Mirror Desk",0.0,191.89,1,100,-inf
1110,PU Leather Upholstered Queen Bed Frame With Deep Button Tufted Headboard and Headboards Bedroom Black Platform Bed Frame,660.11,390.07,4,100,40.90833345957492
1111,"Nightstand with Wireless Charging Station,Smart Gloss Night Stand with 3 Colors Dimmable Sensor Light,Bedside Table Glass Top",0.0,69.35,2,100,-inf
1112,Small Gaming Desk with Power Outlets LED Light 43 Inch L Shaped Computer Desk with Monitor Stand Storage Shelves Reversible,198.12,93.06,5,100,53.028467595396734
1113,"1pc Rocking Chair, High Backrest Rocking Accent Chair, Padded Seat Chaise Lounge With Headrest, Comfy Chair For Home Bedroom",0.0,96.39,8,100,-inf
1114,"Nightstand with Charging Station, Dresser 3 Fabric Chest of Drawers, Storage for Bedroom, Hallway, Closet,",87.19,35.12,3,100,59.72015139350844
1115,"Shoe cabinet with 2 flipped drawers,shoe storage cabinet with charging station for entrance, hallway, living room, free shipping",0.0,94.38,1,100,-inf
1116,Set of 2 Nightstand Charging Station End Side Table Flip Storage Drawer Bedroom Bedside Table,0.0,35.41,2,100,-inf
1117,"33"" W Vanity Desk, Vanity Mirror with Lights and Table Set with Drawers, Vanity Set 3 Lighting Modes Brightness Adjustable",0.0,136.36,0,100,-inf
1118,White Nightstand with Drawer Bedside Table Side Table for Small Place Bed Table End Tables for Living Room Bedroom File Cabinet,0.0,37.51,9,100,-inf
1119,"L-Shaped Sofa with Movable Ottoman, Free Combination Corduroy Upholstered Corner sofa with Wooden Legs and Thicked Cushions",0.0,376.4,5,100,-inf
1120,Large Lazy Inflatable Sofa Chairs PVC Lounger Seat Bean Bag Sofas Pouf Puff Couch Tatami Living Room Supply,45.71,18.69,197,100,59.11179173047473
1121,"Extendable TV Stand,Modern Entertainment Center for Up to 120 Inch TV, Wood Reversible TV Media Console with 3 Drawers, 82-110''",0.0,248.78,4,100,-inf
1122,"WLIVE Wide Dresser with 6 Drawers, TV Stand for 50"" TV, Entertainment Center with Metal Frame, Dresser for Bedroom",102.4,56.94,4,100,44.39453125000001
1123,"Folding Bed, Single Bed for Lunch Break, Sofa Seat, Reclining and Sitting Chair, Backrest Chair, Latex Cushion Thickened Version",0.0,146.8,1,100,-inf
1124,Gaming Chair Office Chairs Backrest and Seat Height Adjustable Swivel Recliner Racing Office Computer Ergonomic Video Game Chair,0.0,91.65,1,100,-inf
1125,"2 Door Wood Wardrobe Bedroom Closet with Clothing Rod inside Cabinet, 2 Drawers for Storage and Mirror",0.0,173.16,1,100,-inf
1126,"Full Size Bed Frame with Headboard and Footboard,14 Inch Metal Platform ,Under Bed Storage,Strong Metal Slats Support,Bed Frame",0.0,66.85,10,100,-inf
1127,"Office Chair,Ergonomic Mid-Back Mesh Rolling Work Swivel Desk Chairs with Wheels,Comfortable Lumbar Support,Pink",0.0,51.4,20,100,-inf
1128,"Upholstered Sectional Sofa with Console, Holders and USB Ports & Wirelessly Charged, for Living Room, Apartment,Office,114.2inch",0.0,530.46,3,100,-inf
1129,"Wooden TV Stand Up to 50"" TVs Black Contemporary Media Console 37.4 lbs 47.63 x 15.55 x 22.79",105.68,37.6,3,100,64.42089326267978
1130,Outdoor Portable Plastic Folding Retractable Beach for Camping Travel Fishing Hiking Chair Lightweight Extendable Adjustable,0.0,3.94,2,19,-inf
1131,"Modern Dresser for Bedroom, 6/9 Drawer Dresser with Metal Handles, Wood Floor Storage Chest ,for Living Room, White & Black",0.0,255.02,5,100,-inf
1132,"Convertible Sectional 3 L-Shaped Couch Soft Seat with Modern Linen Fabric, Space-Saving Sofas for Living Room, Apartment, 70''",0.0,240.05,1,100,-inf
1133,"LED Nightstand, 27"" UV High Gloss Bedside Tables, with Drawer and Adjustable LED Light, Nightstand",0.0,67.81,4,100,-inf
1134,"Makeup Vanity，Desk with Mirror and Lights, Power Outlet,Makeup Desk with Led Lighted ，3 Colors, Makeup Vanity",0.0,168.62,0,100,-inf
1135,"East at Main Kepler Bedside End Table - Handcrafted Mindi Wood Nightstand, Versatile Design (Brown)",0.0,216.55,0,100,-inf
1136,"elifine Vanity Desk with Mirror and Lights, Makeup Corner Vanity with 5 Storage Drawers Shelves and 3 Dim",0.0,143.04,4,100,-inf
1137,"White Nightstand, Mid Century Modern Small Bedside Table End for Bedroom with 2-Tier Storage,",90.84,36.65,4,100,59.654337296345226
1138,"Prepac Astrid Tall White Dresser: 16""D x 20""W x 52""H, 6-Drawer Chest for Bedroom by Prepac - Perfect Chest of Drawers",0.0,111.05,1,100,-inf
1139,Round Side Table with Lower Shelf End Rustic Walnut Nightstand Living Room Bedroom Farmhouse Vibe ULET283T41 15.8 x 15.8,80.48,28.28,1,100,64.86083499005964
1140,Simple Shoe Rack Multi-Layer Household Shoe Cabinet Rental Student Dormitory Door Space-Saving Multi-Function Shelves,25.29,8.18,2,100,67.65519968366944
1141,"Modern Makeup Vanity Desk with Glossy Desktop,Bedroom Home Office Writing Desk with Drawers, for Dressing Table Without Mirror",0.0,108.14,1,100,-inf
1142,Glass Door Beverage Refrigerator and Cooler with Adjustable Shelves LED Light Home Office Bar 3.2 cu ft Compact Mini Fridge 115,0.0,136.24,15,100,-inf
1143,Nordic Ins Net Red Bedside Table Modern Minimalist White Round Creative Small Cabinet Mini Simple Plastic Side Cabinet 협탁,0.0,104.85,185,100,-inf
1144,"Dresser with 12 Drawers 2 in 1 for Bedroom,Wooden Closet Organizers and Storage,Follow Mounting Drawer of Chest for Liviing Room",0.0,439.93,1,100,-inf
1145,"Storage 2 Flip Drawers, Slim Wooden Freestanding Cabinet with Cubby and Shelf, Hidden Narrow Shoe Rack Organizer, Black",0.0,95.06,3,100,-inf
1146,"Shoe Rack Bench, 3-Tier Bamboo Shoe Storage Organizer, 11.3 x 27.6 x 17.8 Inches",0.0,36.07,0,100,-inf
1147,Household Bedroom Wardrobe Portable Assembly Storage Closet Large Capacity Bedroom Dustproof Wardrobe Simple Assembly Wardrobe,55.22,24.96,1,100,54.79898587468308
1148,Reinforced Simple Cloth Wardrobe Storage Wardrobe Dust Proof Wardrobe Dormitory Steel Frame Reinforcement Combination Simple,0.0,7.64,9,85,-inf
1149,"Faux Leather/Linen Fabric Sectional Sofa Couch, Modern L-Shaped Modular Couch Upholstered 3/6 Seaters Living Room Sofa Couch",1620.8,318.16,14,100,80.37018756169793
1150,"Narrow shoe cabinet, entrance shoe cabinet with 3 flip-out drawers, wooden hidden shoe cabinet, organizer",0.0,68.34,16,100,-inf
1151,"Prepac Fremont Superior 5-Drawer Chest for Bedroom - Spacious and Stylish Chest of Drawers, Measuring 17.75""D x 31.5""W x 44.75""H",0.0,150.5,0,100,-inf
1152,"6 Drawer Dresser, Mid-Century Modern Dresser Wide 6 Chest of Drawers, Wooden Storage Cabinet for Entryway, Bedroom, Living Room",0.0,153.68,1,100,-inf
1153,Recliner Chair for Living Room Massage Recliner Sofa Reading Chair Single Sofa Home Theater Seating Modern Reclining Chair,0.0,133.89,12,100,-inf
1154,Outdoor Portable Folding Chair Combat Ready Bench Fishing Small Stool Travel Camping Maza Ultralight Queue Subway,0.0,2.84,2,18,-inf
1155,"King Size Bed Frame and 65"" Headboard, Upholstered Beds with Golden Plating Trim, No Box Spring Needed, Bed Frame",468.01,274.81,4,100,41.2811692057862
1156,Shoes Organizer Living Room Cabinets Cabinet Shoe Rack Shoerack Plant Shelves for Plants Organizers Mower to Save Wooden Shoes,0.0,14.17,23,29,-inf
1157,"Modern farmhouse rectangular dining table, 36 inches deep x 60 inches wide x 30 inches high, free shipping",0.0,229.12,0,100,-inf
1158,"6 Drawer Double Dresser, Wood Dresser Chest with Glossy Surface, Storage Accent Cabinet for Bedroom Living Room,Black White",0.0,229.61,2,100,-inf
1159,Clear Stackable Shoe Storage Boxes Large Size Side Open Design 6 Pack Shoe Organizer with Magnetic Door Display Sneakers,0.0,36.73,0,100,-inf
1160,"Prepac Double Drawer Dresser, 52.5"" W x 29.5"" H x 16"" D, Simple Black，Multiple colors to choose from",392.95,190.47,8,100,51.52818424735971
1161,"Dresser for Bedroom Drawer Organizer Fabric Storage Tower with 5/6/8/9 Drawers, Steel Frame, Wood Top for Bedroom, Closet",0.0,47.85,35,100,-inf
1162,"Snug Fit Friheten Slipcover for The IKEA Friheten with Chaise Corner Cover, Sofa Bed Cover, Sectional Slipcover Replacement",0.0,170.6,7,100,-inf
1163,"Albott King Size Platform Bed Frame, 65"" Velvet Upholstered Bed with Gold Trim Headboard/Wooden Slats/No Box Spring Needed/Green",0.0,301.7,2,100,-inf
1164,Sweetcrispy Dresser for Bedroom Tall Drawer Dresser Organizer Storage Drawers Fabric Storage Tower with 8 Drawers,0.0,46.25,1,100,-inf
1165,"living room sofas Sectional Sofa, Modular Sectional Couch with Ottomans- L Shaped Couch for Living Room, 4 Seater Sofa Sets,104""",0.0,1197.77,0,100,-inf
1166,"Nightstand Set of 1 with Charging Station, Bedside Table for Bedroom, Living Room, Grey, End Tables",0.0,32.31,22,100,-inf
1167,"2 Drawer Nightstand for Bedroom, Mid Century Modern End Table with Charging Station USB Ports and Outlets for Living Room",131.36,59.68,3,100,54.56760048721072
1168,Bench Seat Shoe Storage Cabinet Organizer Two-Tier Flip Drawer Narrow Entryway Closet White 11.8 x 23.8 x 19.1 Inches,112.27,35.92,4,100,68.00570054333303
1169,"Wardrobe Armoire with 4 Sliding Doors, 3 Drawers, Hanging Rods & Storage Shelves, with Silver Handles, Wardrobe Armoire",0.0,498.93,0,100,-inf
1170,"Makeup Vanity Set with Lights in 3 Colors,Vanity Desk with Mirror and Lights & Charging Station",0.0,166.59,1,100,-inf
1171,"Queen Upholstered LED Bed Frame with 2 Storage Drawers, Velvet Platform Bed with Wingback Headboard",673.24,335.12,7,100,50.222803160834175
1172,"Fabric Dresser with 7 Drawers - Storage Tower Organizer Unit for Bedroom, Living Room, Closets - Sturdy Steel Frame, Wooden Top",85.05,40.78,26,100,52.0517342739565
1173,"White Vanity Desk with Mirror and Lights, Modern Makeup Vanity Table Set with 6 Storage Drawers and Cushioned Stool for Bedroom,",0.0,169.97,1,100,-inf
1174,Portability Foot Rest Under Desk Footrest Ergonomic Foot Stool with Massage Rollers Foot Rest for Home Office Work Fast Ship,17.87,8.04,1000,100,55.00839395635143
1175,"Industrial Pipe Clothing Rack, Reversible 118.3'' Clothes Rack for Hanging Clothes, Heavy Duty Garment Rack Closet Ward",0.0,159.66,3,100,-inf
1176,Low Roller Seat Stool Low Noise Sturdy Swivel Rolling Stool Pulley Wheels Stool for Kitchen Fitness Garage Office Barber Shop,16.49,13.99,10,100,15.160703456640379
1177,"Full size bed frame velvet upholstered platform bed with heavy duty mattress base with gold metal frame and planks, off-white",0.0,140.85,1,100,-inf
1178,"Stylish Metal Shoe Rack, Simple Shoe Shelf, Footwear Organizer, Stand Holder, Space-saving Black Shoe Shelf for Living Room",24.12,7.27,65,100,69.85903814262024
1179,"Vanity Table Set with Mirror 2 Storage Drawer Makeup Desk Cushioned Stool Set Modern Dressing Vanity Table for Bedroom, White",135.02,102.02,1,100,24.44082358169161
1180,"5 Drawers Dresser Fabric Dresser for Bedroom, Long Dresser with Wood Top for Bedroom, Closet, Entryway, Black",64.68,30.84,3,100,52.319109461966605
1181,Luxury Living Room Sofa Furgle Chair Soft Suede Oversized Chair Lazy Floor Sofa for Living Room Corner Chair Caterpillar Sofa,0.0,236.87,84,100,-inf
1182,GIANXI Summer Camp Bed Folding Chair Office Nap Bed Recliner Napping Appliance Accompanying Bed Folding Bed With Cushion,72.19,35.98,13,100,50.159301842360435
1183,"Queen Bed Frame, Storage Headboard with Charging Station, Metal Platform Bed Frame Queen Size Mattress Foundation",0.0,105.02,4,100,-inf
1184,2PC Leather Dining Chair Iron Modern Simple Sponge Backrest Chair Home Nordic Leather Dining Room Chairs,125.6,70.42,38,100,43.93312101910828
1185,Low Rolling Stool Mini Ground Stool 360 degree Rolling Adjustable Round Rolling Stool With Wheels Household Walking Round Chair,14.62,8.62,2,100,41.03967168262654
1186,Smart Bedside Table with Fingerprint Lock Large Capacity with Drawers LED Ultra Smart Bedside Table with Wireless USB Charging,109.65,52.12,1,100,52.46694026447789
1187,"Living Room Sofa, Convertible Sectional Sofa, L-shaped Storage Sofa, Ottoman-style Small Space Reversible Sectional Sofa",809.32,350.1,6,100,56.74146196807196
1188,Small Gaming Desk with Power Outlets LED Light 43 Inch L Shaped Computer Desk with Monitor Stand Storage Shelves Reversible,0.0,122.32,2,100,-inf
1189,"Glass coffee table - metal frame circular coffee table, 32.3 inches deep x 32.3 inches wide x 18.31 inches high",0.0,199.58,0,100,-inf
1190,"Natural Wood Coffee Table, Contemporary Table, Wood Tea Table for Living Room with Metal Legs, Clear Lacquer Finish Coffee Table",0.0,208.28,1,100,-inf
1191,Modern Bedside Table with Wireless Charging USB Ports LED Lights 3 Drawers Black Nightstand,164.08,54.71,6,100,66.65650901999025
1192,"Queen Bed Frame,with 4 Drawers Adjustable Headboard, Wooden Slats, Diamond Stitched Button Tufted Design, Bedroom Bed Frames",0.0,270.49,3,100,-inf
1193,"Dining Table Set for 4, Rectangular Faux Marble Tables and 4 PU Leather Chairs, 5 Pieces Kitchen Table Sets, Dining Room Set",0.0,141.96,0,100,-inf
1194,Under Desk Footrest Ergonomic Foot Stool with Massage Rollers Max-Load 120Lbs Desk Leg Rest Pain Relief for Home Office Work,13.37,7.37,150,100,44.876589379207175
1195,IHOME Lazy Sofa Tatami Home Living Room Dormitory Rental House Net Red Ins Girly Style Bedroom Balcony Small New Drop Shopping,0.0,28.66,10,78,-inf
1196,Dining Chairs Set of 4 for Living Room with Black Metal Legs,0.0,110.34,2,100,-inf
1197,"PU/Velvet Leather Dining Chairs Set of 6, Upholstered Dining Room Chairs with Ring Pull Trim & Button Back, Luxury Tufted",0.0,231.39,9,100,-inf
1198,"Velvet Dining Chairs Set of 6, Upholstered Dining Room Chairs with Ring Pull Trim and Button Back, Luxury Tufted Dining C",203.59,95.79,23,100,52.94955547914927
1199,Rocking Chair Lazy Technology Cloth Lounge Chairs 5 Angle Adjustment Detachable Washable Relaxation And Comfort Recliner Chair,132.06,74.04,68,100,43.93457519309404
1200,"Dining Table Set for 4/Computer Desk,Kitchen Table with 2 Chairs and a Bench,Table and Chairs Dining Set 4 Piece Set",0.0,145.6,0,100,-inf
1201,"Traditional Tall Nightstand Side Table with 3 Drawers, Functional Tall 3-Drawer Bedside Table 16"" D x 23"" W x 29"" H, Espresso",0.0,66.46,12,100,-inf
1202,"YITAHOME 46'' Large Makeup Vanity Desk Set with Large LED Lighted Mirror & Power Outlet, Glass Top Vanity with 11 Drawers",0.0,243.74,3,100,-inf
1203,Basics Folding Plastic Chair with 350-Pound Capacity 6-Pack,0.0,73.27,2,100,-inf
1204,"GTPLAYER Gaming Chair, Computer Chair with Footrest and Bluetooth Speakers, High Back Ergonomic Gaming Chair, Reclining",272.9,133.18,7,100,51.19824111396115
1205,"Faux Leather High Back Dining Chairs for Kitchen, Set of 4, Black",0.0,104.33,3,100,-inf
1206,"Vanity Makeup Mirror Desk with Stool,Makeup Vanity Set with 6 Drawers and Shelves,Vanity Table with Power Strip",0.0,176.52,1,100,-inf
1207,24cmx20cmx18cm Portable Step Stool Durable Plastic Stool With Comfortable Handle Folding Stool For Adults Children,7.47,7.47,10,100,0.0
1208,"65"" W Makeup Vanity Desk with Mirror and 3-Color Lights, 8 Drawers Vanity Table with Side Storage Shelf, Bedroom Dressing Table",813.07,161.11,9,100,80.18497792318004
1209,"Modular Sectional Sleeper Sofa with Pull Out Bed, Velvet U Shaped Sectional Couch with Storage Ottoman Convertible 7-Seater Sofa",0.0,1425.97,0,100,-inf
1210,PP Folding Stools Portable Lightweight Chairs For Picnic BBQ Beach Bathroom Kitchen Office Garden Camping Fishing Outdoor,7.27,1.27,9,100,82.53094910591471
1211,"Shoe Rack, 8 Tier Shoe Storage Cabinet 32 Pair Plastic Shoe Shelves Organizer for Closet Hallway Bedroom Entryway",0.0,42.87,9,100,-inf
1212,"Walker Edison Sonoma 6-Drawer Solid Wood Dresser, Walnut",0.0,217.42,1,100,-inf
1213,"Living Room Sofa, Oversized Sofas-85inch 3Seater Sofas Comfy for Living Room Sofa, Bouclé Couch",624.01,369.91,2,100,40.72050127401804
1214,"Narrow Shoe Storage Cabinet, Shoe Cabinet for Entryway with 3 Flip Drawers, Wood Hidden Storage",0.0,68.16,27,100,-inf
1215,"Spacious Wardrobe with Dustproof Cover - Durable Steel Frame - Ideal for Bedroom, Dorm, Entryway Organization",65.04,29.12,36,100,55.227552275522754
1216,"Closet Wardrobe, Portable Closet for Bedroom, Clothes Rail with Non-Woven Fabric Cover, Clothes Storage Organizer, 59 x",0.0,46.8,1,100,-inf
1217,"Small Dresser with 5 Drawers for Closet,Organizer Unit for Bedroom, Living Room & Closets,Dresser for Bedroom,",0.0,34.85,2,100,-inf
1218,"Wardrobe made of engineered wood floor-mounted, 3 doors, can be used in bedroom, 2 drawers (black)",0.0,213.1,3,100,-inf
