,productTitle,originalPrice,price,sold,tagText,Discount_percentage
1391,"MUMUCC Multifunctional Foldable And Adjustable Aluminum Alloy Reading Stand With Spring Clip For Laptops, Tablets & Thick Books",47.7,21.94,3000,100,54.00419287211739
1392,Inflatable Portable Sofa Folding Lazy Bean Bag Sofas Chair Pouf Puff Couch Tatami Living Room Footstool Inflatable Bed Set,0.0,7.9,10,66,-inf
1393,"DWVO Makeup Vanity Desk with Large Lighted Mirror with Power Outlet and LED Strip, 3 Color Lighting Modes with Adjustable",0.0,154.9,6,100,-inf
1394,1/2/3PCS Plastic Folding Step Stool Portable Foldable Outdoor Dining Stool Multi Purpose Step Stool for Home Office Bathroom,26.56,8.34,1,100,68.59939759036145
1395,Door opening simple fabric wardrobe for home hanging clothes Fabric wardrobe 112CM with 3 storage boxes available,88.31,82.31,0,100,6.794247537085267
1396,Office Foot Rest under Desk Foot Stool Support Desk Step for Work Home Study Computer,10.76,4.76,3,100,55.762081784386616
1397,56.6″W Modern Loveseat 2 Seater Sofa Luxurious Velvet Fabric Couch Futon with Gold-Tone Metal Arms and Legs Sofa,0.0,136.65,12,100,-inf
1398,"6 Wood Drawers,Tall Dresser with Large Organizer, Wood Dressers",0.0,141.28,0,100,-inf
1399,Swing Egg Wicker Chair and Reinforced Solid Structure Hammock Stand with 2 Storage Baskets and 3Hooks Outdoor Patio Swing Chair,0.0,153.66,1,100,-inf
1400,"Classic Puresoft PU Padded Mid-Back Office Computer Desk Chair with Armrest, 26""D X 23.75""W X 42""H, Black,Office Chairs",0.0,81.19,39,100,-inf
1401,Lazy Rocking Chair Technology Cloth Lounge Chairs Detachable Washable 5 Angle Adjustment Relaxation And Comfort Recliner Chair,141.01,73.06,26,100,48.18807176795971
1402,"Redlife Combined TV Stand, Entertainment Center w/ Storage Shelf for 32~80'' TV Media Console-TV Table for Living Room & Bedroom",0.0,157.35,1,100,-inf
1403,"Narrow Shoe Storage Cabinet, Shoe Cabinet for Entryway with 3 Flip Drawers, Wood Hidden Shoe Storage, Freestanding",0.0,81.4,1,100,-inf
1404,"Rattan Nightstand with 2 Drawers, Rustic Side Table Night Stand with Storage,for Living Room Bedroom Set of 2",0.0,77.39,5,100,-inf
1405,"10 Drawers Dresser Fabric Storage Tower Cabinet Bin Organizer, Black Grey Organizer Chest",0.0,60.33,2,100,-inf
1406,Computer Armchair Girlfriend Computer Gaming Chair Pink Gaming Chair With Footrest Sister Wife and Love (Pink) Desk Gamer Office,250.27,144.16,6,100,42.39820993327207
1407,"US BestOffice Gaming Desk Computer Desk 47""x 23"" Home Office Desk Extra Large Modern Ergonomic Black PC Carbon Fiber Table",87.12,37.56,3,100,56.8870523415978
1408,"Vintage Dresser for Bedroom with 5/7 Drawers, Wood Drawer Dresser Chest of Drawers for Closet, Living Room, Hallway",0.0,103.66,4,100,-inf
1409,Wooden Outdoor Folding Picnic Table With Glass Holder Round Foldable Desk Wine Glass Rack Collapsible Table for Garden Party,7.87,1.87,7,100,76.23888182973316
1410,"Sleeper Sofa,Sofa Bed- 2 in1Pull Out Couch Bed with Storage Chaise for Living Room, Beige Chenille Couch Sofa Cama Tatami Couch",0.0,326.51,3,100,-inf
1411,"Nightstands Set of 2, End Side Table with Drawer, Bedside Table with Shelf for Living Room Bedroom",66.24,26.46,4,100,60.05434782608695
1412,Lazy Couch Penguin Rocking Chair Adult Lounge Snail Balcony Home Indoor Leisure Rocking Chair Lounge Chair Rocking sofa daybed,534.03,234.32,18,100,56.122315225736386
1413,"Full bed frame, velvet upholstered bed frame, tufted headboard with vertical channels, mattress base, white, platform bed frame",0.0,133.4,3,100,-inf
1414,"WLIVE Tall Bedroom with 13 Drawers, Storage Dresser Organizer unit, Fabric Dresser for Bedroom, Chest of Drawers, Steel Frame,",0.0,93.36,12,100,-inf
1415,"Tribesigns Shoe Cabinet with Doors, 20 Pairs Entryway Shoe Storage Cabinet with Shelves, 5-Tier Modern Free Standing Shoe Racks",0.0,122.58,1,100,-inf
1416,"Modern Tuft Futon Couch Convertible Loveseat Sleeper Reclining Sofa Bed Twin Size with Arms and 2 Pillows for Living Room, Black",0.0,148.73,8,100,-inf
1417,"Queen Size Bed Frame, Platform Bedframe with Shelf Headboard and Charging Station, USB Ports & Power Outlets, Industrial Queen",0.0,140.02,8,100,-inf
1418,"Egg Hanging Swing Chair with Cushions 330lbs for Patio, Bedroom, Garden and Balcony,Stand Egg Chair Wicker Egg Chair",0.0,106.92,1,100,-inf
1419,Studio Stacey Modern and Contemporary White Faux Leather Upholstered Ottoman Bench Foot Rest Stool for Bedr,0.0,38.65,1,100,-inf
1420,Organizer Units for Clothing Closet Commodes Small Chest Storage Tower Make Up Table Dresser for Bedroom With 5 Fabric Drawers,0.0,59.51,15,100,-inf
1421,"16 Drawers Dresser for Bedroom, Tall Dressers & Chests of Drawers with Wood Top, Large Fabric Storage Dresser,Black",0.0,117.1,1,100,-inf
1422,"11-Tier Shoe Storage Cabinet, 31 Open Cubbie Shoe Storage Organizer, Free Standing Space Saving Shoe Rack for Entryway,",0.0,121.45,5,100,-inf
1423,"Frame Metal Platform, Max 3500lbs Heavy Duty Metal Slat Support,High Underbed Storage Bed Frames",0.0,80.48,3,100,-inf
1424,"Convertible Sectional Sofa Couch, 4 Seat Sofa Set for Living Room U-Shaped Modern Fabric Modular Sofa Sleeper with Double Chaise",703.51,345.76,31,100,50.85215561967848
1425,Criss Cross Chair - Armless Desk Chair No Wheels Cross Legged Office Chair Wide Swivel Home Office Desk Chairs,0.0,47.46,3,100,-inf
1426,LEEGOHOME Wardrobe 110/130/150/170x45CMx170CM Closet Wardrobe with 23MM Steel Pipe Bedroom Foldable Cloth Wardrobe,36.12,15.56,22,100,56.92137320044296
1427,"67 in Portable Closet Wardrobe for Hanging Clothes, Wardrobe Closet , 4 Hanging Rods and Side Pockets, 8 Storage Shelves",67.52,26.41,7,100,60.88566350710901
1428,Modern Style Solid Wood Bedside Table with Wireless Charging Smart 2 Drawers Bedroom Nightstands with Lock 40cm,0.0,91.82,13,9,-inf
1429,High Quality Outdoor Rocking Chair Rain Shelter Garden Swing Garden Waterproof Dustproof Lounge Chair Sun Shade Canopy,14.82,2.31,8,100,84.41295546558703
1430,Kids Pod Swing Seat Hammock Chair Children's Hanging Chair Durable Outdoor Garden Patio Swing Folding Hanging Hammock Chair,9.93,5.89,12,100,40.684793554884195
1431,Living Room Light Luxury Rocking Chair Reclining Balcony Home Lounge Chair Foldable Lunch Break Sofa with Armrests Rocking Chair,0.0,30.7,1,50,-inf
1432,Foldable Shoe Storage Box Stackable Dustproof Transparent Living Room Sneaker Cabinet For Closet Multi Layer Cubby Shoes Rack,64.4,30.11,11,100,53.245341614906835
1433,"4 Drawer Dresser, Drawer Chest, Tall Storage Dresser Chest Cabinet Organizer Unit with Metal Legs, Small Dresser for Bedroom,",0.0,107.89,1,100,-inf
1434,Double door folding simple cloth wardrobe thickened and thickened 19mm steel pipe single person storage wardrobe,70.32,64.32,0,100,8.532423208191126
1435,"Office Desk Leather Gaming Computer Chair with Adjustable Swivel Task and Flip-up Arms, Black-White",0.0,71.02,5,100,-inf
1436,30-inch Faux Leather Folding Storage Ottoman with Padded Lid or Bench with Removable Bin for Living Room or Bedroom,37.14,21.5,6,100,42.110931610123856
1437,"3 Drawer Bedside Table with Wooden Legs, Modern White Drawer Dresser Bedside Table, Perfect for Bedroom, Living Room",0.0,84.5,3,100,-inf
1438,Transparent Folding Chair Acrylic Minimalist Modern Dining Chairs North Europe Style Lightweight INS Transparent Photo Chairs,52.34,29.34,93,100,43.943446694688575
1439,"Adult lazy sofa rocking chair, single-person balcony leisure sofa chair, luxury living room internet-famous rocking chair",0.0,227.77,1,100,-inf
1440,"Full Size Platform Bed with LED Lights, Adjustable Tufted Headboard, Wood Slats - White",0.0,152.76,13,100,-inf
1441,Computer Chair Office Chair High Back Ergonomic Office Chair With Lumbar Support Adjustable Headrest 3D Armrest and Lumbar Gamer,0.0,88.61,19,100,-inf
1442,Inflatable Airplane Foot Rest Height Adjustable Wear Resistant Super Soft Widely Used Folding Portable Airplane Chair Extender,0.0,3.38,16,79,-inf
1443,Acrylic Transparent Coffee Table Clear Drink Table Small Round End Modern Living Room Side Table Acrylic desk Home Decorations,37.26,31.26,112,100,16.10305958132044
1444,"Office Chair,Ergonomic Rolling with 4D Adjustable Armrest,3D Lumbar Support, Mesh Swivel 26""D x 26""W x 53""H Metal Office Chairs",0.0,219.89,1,100,-inf
1445,Rectangle Glass Coffee Table-Modern Side Coffee Table with Lower Shelf Black Wooden Legs-Suit for Living Room,0.0,84.81,5,100,-inf
1446,"Twin-Over-Twin Bunk Bed Espresso Converts To 2 Individual Twin Beds, Getting Up and Down in Bed",0.0,296.2,3,100,-inf
1447,"Ergonomic headboard bed frame, upholstered Led bed frame with light and charging station, premium Pu leather platform bed frame",0.0,198.25,4,100,-inf
1448,"Makeup Vanity Desk with LED Lighted Sliding Mirror,Jewelry Cabinet and 4 Drawers,Bedroom Dressing Table.",0.0,318.37,4,100,-inf
1449,1pc Outdoor Camping And Fishing Hand Bag Chair Rainbow Portable Plastic Circular Folding Chair Retractable Queue Chair,17.71,11.71,6,100,33.879164313946916
1450,Stackable Shoe Storage Containers Set of 10 with Magnetic Door Sturdy Clear Boxes Men's Sneaker Storage and Organization,0.0,30.82,1,100,-inf
1451,"SMUG Office Desk Computer Chair, Ergonomic High Back Comfy Swivel Gaming Home Mesh Chairs with Wheels, Lumbar Support, Adjustabl",0.0,47.52,8,100,-inf
1452,32 Pairs Shoe Organizer Cabinet 8 Cube 16 Tiers Shoe Rack with Clear Door Plastic Storage System Free Standing Rack Organizing,0.0,33.8,14,100,-inf
1453,"Bed Frame with Wingback, Upholstered Beds Frames with Diamond Tufted Headboard and Footboard, No Box Spring Needed, Bed Frame",296.4,171.84,3,100,42.0242914979757
1454,"Shoe Cabinet,48 Pairs Shoes Rack 3 By 8 Tier Shoes Organizer Space Saving Storage for Closet Hallway Living Room Bedroom White",0.0,59.24,5,100,-inf
1455,"Upholstered Queen Platform Bed Frame, With 4 storage drawers and headboard, Diamond sewn button tufting, Base wood slat support",370.75,179.38,11,100,51.61699258260284
1456,"Shoe Cabinet with 3 Clamshell Drawers, Modern Slim Hidden Shoe Storage and Freestanding Tipper Rack with Narrow Entry Grey",0.0,163.92,2,100,-inf
1457,"Fabric Dresser for Bedroom, Storage Drawer Unit,Dressers with 10 Deep Drawers for Office,White Vanity Desk",0.0,71.08,4,100,-inf
1458,Nightstands Set of 2-Natural Beside Table with Storage Drawer - Midcentury Modern Bedroom Storage Cabinet,0.0,64.56,18,100,-inf
1459,"4 Door Wardrobe Armoire Closet with Mirror Door, Wardrobe Cabinet with 2 Drawers & Hanging Rod, Armoire Dresser Wardrobe Clothes",0.0,467.98,2,100,-inf
1460,"Modern convertible tufted linen upholstered futon sofa bed with 2 pillows, padded loveseat",0.0,210.24,4,100,-inf
1461,LEEGOHOME Wardrobe 105cmx45cmx170cm 26mm Steel Pipe Assembly Hanging Bedroom Clothes Bold Simple Oxford Cloth Wardrobe,0.0,18.24,2,100,-inf
1462,"TV stand, LED lighting entertainment center, modern live fireplace with high-gloss storage cabinets",365.59,176.79,3,100,51.64255039798682
1463,"Swings Outdoor, Black Outdoor Swings for Adults with Removable Cushion and Coated Steel Frame, Patio Swings for Outside",0.0,89.59,11,100,-inf
1464,"12 Pack Shoe Storage Box, Shoe Organizer for Closet,Space Saving Foldable Sneaker Shoe Rack Containers Bin Holder",0.0,37.24,10,100,-inf
1465,"Furinno Turn-N-Tube No Tools 3D 3-Tier Entertainment Stand up to 50 inch TV, Amber Pine/Black",0.0,65.64,5,100,-inf
1466,Multilayer Dustproof Shoe Shelf Organizer for Closet Shoe-shelf Stackable Shoe Rack Large Closet Shoe-shelfs Shoes Storage Racks,42.37,23.76,2,100,43.92258673589804
1467,"Cute Bear Coffee Bedroom Bedside Small Table,Bear Statue Shoes Stool Creative Cabinet Tray Ornament Home Decor Housewarming Gift",0.0,26.18,15,92,-inf
1468,Shoerack Shoes Organizer for Teeth Wallets and Bags for Women Fashion 2024 Living Room Cabinets Shoe Rack Organizer Shoe-shelf,0.0,11.3,10,64,-inf
1469,Simple Folding Sofa Bed Apartment Small Family Simple Reclining Chair Single Folding Sofa Bed lounge chair luxury modern sofa,0.0,165.09,20,100,-inf
1470,"Makeup Table, Built-in Light, 7 Drawers, Mirror, White Dressing Table in Bedroom, 58.2 '' High X 47.3 '' Wide X 16.9 ''",0.0,273.05,1,100,-inf
1471,"Nightstand with Charging Station, LED Bedside Table Adjustable Fabric Drawer, Night Stand Storage, 3-Tier B",0.0,34.22,41,100,-inf
1472,"9-Cube Storage Organizer, White, Bookcase, Display Shelf Cube Storage for Bedroom, Hallway, Office, Living Room Cabinet",86.1,41.36,3,100,51.96283391405342
1473,"Shoe Rack Organizer, 48 Pair Shoe Storage Cabinet with Door Expandable Plastic Shoe Shelves for Closet,Entryway,Hallway,Bedroom",0.0,50.45,25,100,-inf
1474,"Living Room Chairs, Convertible Chair Bed, Adjustable Chair with Pillow and Pocket, Multi-Functional Sleeper Living Room Chairs",0.0,388.04,4,100,-inf
1475,"Glass Curio Cabinet Display Case Collectibles Showcase Lockable Design 64.2""Hx16.9''Lx14.6''W Black",0.0,136.21,3,100,-inf
1476,"Convertible Sectional Sofa Velvet L Shaped Couch Reversible 4 Seat Corner Sofas for Small Apartment,Velvet Black Sofa",3265.13,647.03,24,100,80.18363740494254
1477,"Collapsible shoe rack for closet plastic collapsible shoe rack, stackable clear folding shoe storage box high locker",0.0,83.6,13,100,-inf
1478,"HAIOOU Coffee Table, Mid Century Modern Style Cocktail Table TV Stand with Drawer, Open Storage Shelf",101.74,58.09,2,100,42.90347945744053
1479,"Velvet Futon Sofa Bed, 73-inch Sleeper Couch with 3 Reclining Angles, Living Room Loveseat Sofa Two Pillows (Cream White Velvet)",0.0,196.44,10,100,-inf
1480,Stackable Shoe Organizers Drawers 18 PCS Storage Boxes Black XL Size Ideal All Shoes Sandals Sneakers High Heels Ventilated,0.0,52.33,1,100,-inf
1481,"41"" Marble White Cool Coffee Table for Living Room,Rectangular Glossy Smart Contemporary Center Table for Waiting Area,White",0.0,112.51,2,100,-inf
1482,Cabinet/ Closet Miscellaneous Storage Storage Cabinet Clothing Cupboard Cinnamon Cherry Finish Hanger Cabinets Wardrobes Locker,0.0,159.18,9,100,-inf
1483,Wooden Small Stool Bedside Step Stool Indoor Mobile Step Stool Foot Stool Bathroom Toilet Wooden Stool Ornament,12.08,6.08,3,100,49.668874172185426
1484,Set of 2 LED Nightstands Nightstand with 2 Drawers High Gloss Night Stands with 16 Colors LED Lights Side Table,0.0,89.61,4,100,-inf
1485,"LED Nightstand with Wireless Charging Station & USB Ports, Bedside Tables with 2 Drawers, with 3 Color & Adjustable Brightness",0.0,102.14,2,100,-inf
1486,"1pc hammock, outdoor camping leisure anti-rollover duck bill buckle hammock, travel supplies swing",17.71,5.43,38,100,69.33935629587805
1487,"Nightstands Set of 2, Night Stand with Drawers, Bedside Tables with Solid Wood Legs and Large Storage Space for Bedroom",0.0,91.83,2,100,-inf
1488,"67 Inch Large Capacity Portable Closet Wardrobe with Non-Woven Fabric Cover, 4 Hanging Rods, 8 Shelves - Black Clothes Storage",0.0,39.55,1,100,-inf
1489,Apartment Giant Bean Bag Sofa Chair Cotton Linen Bedroom Lazy Sofa Couch Recliner Floor Seat Tatami Puff Armchair Corner Comfy,0.0,66.04,20,48,-inf
1490,Nordic Adult Rocking Chair Washable Technology Cloth Lazy Sofa Lounge Chair Balcony Sun Recline Adjustable Ergonomic Deckchair,140.63,78.85,16,100,43.930882457512624
1491,"Outdoor Sofa Four Piece Set, with Soft Cushion and Tempered Glass Table, Willow Wicker Garden Sofa",236.96,136.18,6,100,42.5303848750844
1492,"Outdoor Sofa Four Piece Set, with Soft Cushion and Tempered Glass Table, Willow Wicker Garden Sofa",236.96,136.18,6,100,42.5303848750844
1493,"Electric Standing Desk with Drawers,55 Inch Whole-Piece Glass Desktop,Height Adjustable Stand Up Sit Stand Home Office Ergonomic",0.0,244.72,7,100,-inf
1494,"Home Office Chair Velvet Desk Chair Accent Armchair Upholstered Modern Tufted Chairs Dining Chairs, Tufted Vanity Chairs Sid",0.0,68.59,2,100,-inf
1495,Wooden Folding Picnic Table Outdoor Portable Holder Round Foldable Desk Wine Glass Rack Collapsible Table For Garden Party,17.46,3.79,43,100,78.29324169530356
1496,"Dresser for Bedroom, Chest of Drawers, Closet Storage with 8 Drawers, Cloth Dresser Clothes Organizers Tower with Fabric Bins",0.0,40.6,10,100,-inf
1497,"Ice Cream, Corn Stool, Trendy Home Burger Chair, Macaron Ornaments, Resin Low Stool Decoration Gift Living Room Stool",0.0,104.68,2,100,-inf
1498,"Office Desk Mat,Non-Slip PU Leather Desk Blotter, Computer Desk Pad, Waterproof Desk Writing Pad for Office and Home 60cm x 35cm",5.94,0.99,32,100,83.33333333333333
1499,"Nightstand with Power Outlet and LED Light, Side End Table with Storage Cabinet, Modern Bedside Table for Bedroom, Living Room",0.0,37.41,11,100,-inf
1500,1PCS Nordic Dressing Chair Designer Home Designer Armchair Living Room With Backrest Fashion Fauteuil Salon Household Essentials,0.0,21.19,42,20,-inf
1501,GIANXI Summer Outdoor Folding Chair Adult Siesta Artifact Living Room Simple Lounge Chair Siesta Artifact With Mattress Camp Bed,61.32,28.38,36,100,53.71819960861056
1502,MOMO Cream Style Small Flat Tea Table Small Household Sofa Side Table Celebrity INS Designer Bedroom Plastic Cute Side Table,0.0,37.69,34,70,-inf
1503,"Dresser, 10 Drawer Dresses Bedroom Fabric Dresses, Bedroom Chest of Drawers with Side Pockets and Hooks",0.0,64.68,1,100,-inf
1504,"Glass Display Cabinet, White Floor Standing Glass Bookshelf, Glass Display Case with 4 Clear Dividers for Collectibles",455.74,267.44,10,100,41.3174178259534
1505,Small Wooden Stool Round Polished Modern Storage Flower Pot Stand Eco-friendly Wooden Color Children's Stool Home Accessories,10.45,10.45,31,100,0.0
1506,Wassily Chair Lazy Sofa Scandinavian Saddle Leather Single Chair Stainless Steel Leisure Single Sofa Chair Lounge Chair,0.0,115.15,58,16,-inf
1507,Shoerack Large Capacity Stackable Tall Shoe Shelf Storage to 50-55 Pairs Shoes and Boots Sturdy Metal Free Standing Organizer,0.0,40.62,2,100,-inf
1508,"Nightstand, Madison Modern 2 Drawer Nightstand, Walnut Nightstands",0.0,49.17,3,100,-inf
1509,"Fameill White Vanity Desk with Mirror and Lights,Makeup Vanity with 2 Drawers Lots Storage,Vanity Table with ,35in(L)",0.0,139.28,8,100,-inf
1510,"6 Drawer Dresser,Black Chest of Drawers,Storage Tower Clothes Organizer Closet,Double Dresser for Bedroom, Living Room, Entryway",0.0,198.12,8,100,-inf
1511,Portable Folding Telescopic Stool Lightweight Plastic Subway Queuing Chair Outdoor Camping Chair Fishing Seat with Carry Bag,30.18,11.2,900,100,62.88933068257124
1512,"LOKEME Portable Closet, 55.5 Inch Wardrobe Closet for Hanging Clothes with 2 Hanging Rods, 9 Clothes Storage Organizer Shelves",0.0,43.32,0,100,-inf
1513,"Dressing Cabinet, 9-drawer Dresser, Chest of Drawers with Fabric Storage Bins, Tall Dresser with Wooden Tops",97.02,47.01,10,100,51.54607297464441
1514,"Vanity Desk with Mirror and LED Light, Makeup Vanity Desk with Drawers and Open Shelf and Storage Cabinet",0.0,177.9,3,100,-inf
1515,Free Shipping Drawers Cabinet Mobile Lateral File Cabinet Printer Stand With Open Storage Shelves for Home Office White Cabinets,0.0,70.98,6,100,-inf
1516,"Shoe Cabinet, Modern Freestanding Shoes Storage Cabinet with 2 Flip Drawers & 1 Slide Drawer, Open Shelf, Shoe Cabinet",0.0,118.92,11,100,-inf
1517,"VECELO Queen Size Bed Frame with Headboard and Footboard, Heavy Duty Metal Slat Support, Platform Mattress Foundation, No Box Sp",0.0,84.13,1,100,-inf
1518,"Make-up Dresser with Light and 2 Mirrors, Set, Dresser with Drawers, Bedroom Dresser Black Dressers for Bedroom",437.19,212.6,6,100,51.37125734806377
1519,"70.8"" Large Kitchen Dining Room Table for 6-8 People, Rustic Grey Farmhouse Industrial Wood Style Rectangle Apartment Dinning",280.03,162.02,7,100,42.141913366425015
1520,Shoe Rack Storage Organizer 5-7laye Shoe Cabinets Shoes Storage Rack Space Saving Sneakers Organizer for Wall Corner Shoes Shelf,16.55,10.55,54,100,36.25377643504532
1521,Dinning Table for Restaurant 47 Inch Small Circle Dining Tables With Wood Strip Base for Kitchen Living Room (Natural) Set Home,0.0,227.32,2,100,-inf
1522,"82"" L-Shape Sofa Reversible Sleeper, Pull Out Bed, Storage Chaise and Arms, Corner Couch for Living Room, Linen Sectional Sofa",608.66,359.2,5,100,40.98511484244077
1523,Adjustable 9 Tier Shoe Rack Organizer 72-90 Pairs Sturdy Waterproof Fabric Space Saving Closet Entryway Bedroom Storage Solution,102.04,30.73,3,100,69.88435907487259
1524,"GTRACING Gaming Chair, Computer Chair with Mesh Back, Ergonomic Gaming Chair with Footrest, Reclining",0.0,143.16,6,100,-inf
1525,Home Office Chair Ergonomic Desk Chairs Mesh Computer with Lumbar Support Armrest Rolling Swivel Adjustable Black,0.0,77.1,27,100,-inf
1526,"L Shaped Gaming Desk,Power Outlet and Pegboard,Gaming Desk with Led Lights,Sturdy Desk for Home Office Writing",290.55,168.33,13,100,42.065049044914815
1527,"LED TV Stand for Up 50 to 70 Inch, TVs Entertainment Center Table Stands with 2 Storage and 3 Open Shelves High Gloss, TV Stand",0.0,157.42,5,100,-inf
1528,Ergonomic Feet Pillow Relaxing Cushion Support Foot Rest Under Desk Feet Stool for Home Office Computer Work Foot Rest Cushion,7.76,1.76,27,100,77.31958762886599
1529,"Chaise Longue Sofa Bed with Removable Armrests, 2 Cup Holders, Grey",291.02,172.11,5,100,40.859734726135656
1530,"Mobile Side Table, Small Coffee Table, Cream Style, Creative Sofa Side Table, Modern and Simple Home Balcony Table",0.0,9.36,13,63,-inf
1531,Home Girl Computer Chair Comfortable Study Seat Bedroom Sedentary Back Swivel Chair Student Dormitory Internet Makeup Chair,0.0,204.29,11,100,-inf
1532,Upholstered Bed Frame King Size With Headboard Under Bed Storage No Box Spring Needed/Noise Free/Heavy Duty/White Platform Queen,0.0,203.11,5,100,-inf
1533,Hercules Series Plastic Folding Chair - White - 10 Pack 650LB Weight Capacity Comfortable Event Chair-Lightweight Folding Chair,0.0,131.46,9,100,-inf
1534,1P Shoesbox,0.0,50.75,151,31,-inf
1535,"AMERLIFE Makeup Vanity Table Set with Sliding & LED Lighted Mirror, 45"" Large Vanity with Charging Station, 4 Drawers",0.0,169.14,6,100,-inf
1536,"Nightstands Set of 2 with LED Lights and Charging Station,Bedside Table 2 Fabric Storage Drawers,USB Ports Power Outlets,Brown",0.0,68.02,12,100,-inf
1537,Home Office Chair Ergonomic Desk Chair Mesh Computer Chair with Lumbar Support Armrest Executive Rolling Swivel Adjustable,0.0,46.28,1,100,-inf
1538,"Dresser Set, Dressing Table, Lighting Mirror, Power Strip and Hair Dryer Holder, Dresser with Drawers, Bedroom Storage Shelf",446.13,191.8,1,100,57.00804698182144
1539,Homall Computer Racing Style Pu Leather Ergonomic Adjusted Reclining Video Gaming Single Sofa Chair with Footrest Headrest,304.13,153.6,5,100,49.49528162299017
1540,Simple and Light Luxury Acrylic Sofa Side Small Apartment Living Room Design Sense Tea Table Household Bedroom Bedside Table,0.0,116.93,40,100,-inf
1541,"Night Stand Set 2, Nightstand with 2 Fabric Drawers, Small Wood Nightstands for Bedroom, Bedside Tables Drawers",0.0,48.1,2,100,-inf
1542,"Convertible Sectional Sofa Couch, Modern Chenille Fabric U-Shaped, 4-Seat with Long Chaise for Living Room, Gray Free Shipping",632.34,373.4,8,100,40.949489198848724
1543,"Dowinx Gaming Chair Breathable PU Leather Gamer Chair with Pocket Spring Cushion, Ergonomic Computer Chair with Massage Lumbar",0.0,131.1,3,100,-inf
1544,"Sofa with 2 Seats, Velvet Loveseat, Soft Indoor Sofas with Gold Metal Legs, Living Room Sofa",0.0,201.78,1,100,-inf
1545,European Style Bedside Modern Minimalist Mini Storage Rack Living Room Small Square Table Magazine Table Small Coffee Table,36.64,20.54,62,100,43.9410480349345
1546,Adjustable Laptop Desk Stand Portable Aluminum Ergonomic Lapdesk For TV Bed Sofa PC Notebook Table Desk Stand With Mouse Pad,52.47,25.49,600,100,51.41985896702877
1547,"FAMAPY Vanity Mirror with Lights Desk and Chair, Vanity Desk with Sliding Lighted Mirror, Makeup Vanity with Lights, Drawers",0.0,147.5,14,100,-inf
1548,"King size bed frame, floating bed frame with LED lights, modern low-profile platform,solid pine slatted support,easy to assemble",0.0,190.16,0,100,-inf
1549,Folding Multi-Layer Shoe Cabinet Large Capacity Dust Proof Storage Shelf Phyllostachys Pubescens Easy Installation Shoe Racks,65.36,36.65,37,100,43.92594859241126
1550,56.6″W Modern Loveseat 2 Seater Sofa Luxurious Velvet Fabric Couch Futon with Gold-Tone Metal Arms and Legs Sofa,0.0,121.07,11,100,-inf
1551,Recliner Chair for Living Room Home Theater Seating Single Reclining Sofa Lounge with Padded Seat Backrest (Beige),0.0,94.0,0,100,-inf
1552,"Velvet Barrel Accent Chair with Scalloped Silhouette and Gold Metal Legs, Decorative Piece Suitable for Traditional, Modern",0.0,97.94,9,100,-inf
1553,"Harvey Park Dresser, L: 60.71"" x W: 17.48"" x H: 31.06"", Soft White finish",0.0,217.85,3,100,-inf
1554,"LED TV Stand, for 65inch TVs Wooden Sliding Barn Door TVs Center Media Console Table with Storage and Shelves, TV Stand",0.0,183.33,3,100,-inf
1555,1 Stainless Steel Shoe Rack 3-Layer Tower Storage Shelf Entryway Shoes Organizer Metal Stackable Cabinet Closets Shoe Holder,8.65,7.15,41,100,17.341040462427745
1556,"WLIVE 4 Drawers Dresser and 16 Drawers Dresser Set, Dresser for Bedroom, Closet, Hallway, Storage Organizer Unit,",0.0,112.26,2,100,-inf
1557,Chest of Drawers With Fabric Bins Make Up Table Dresser for Bedroom Wooden Top for TV Up to 45 Inch Vanity Desk Entryway Nursery,0.0,51.43,6,100,-inf
1558,Smart Bedside Table with Wireless USB Charging LED Ultra Narrow Smart Bedside Table Narrow Smart Nightstands,108.02,60.56,5,100,43.93630809109424
1559,"Velvet Dining Chairs Set of 4, Modern with Golden Metal Legs, Woven Upholstered Dining Chairs for Dining",0.0,221.3,6,100,-inf
1560,"5-piece dining table set for 4 people, with chairs, glass countertop, small space, silver color",0.0,106.63,8,100,-inf
1561,"LANTEFUL 10 Tier Shoe Storage Cabinet with Door, Portable Narrow Organizer Rack for 20 Pairs, White Plastic with Hooks for Entry",0.0,38.71,2,100,-inf
